"To pocztek ""Dobrej zmiany"" - na razie PIS widzi goym okiem, 偶e to 
S&P za偶artowaa. Ale  Euro po 4,50 to ju偶 na serio. 
Dobra zmian si zakoczy gdy euro bdzie po 128 PLN i wtedy wszyscy bd siedzie w kociele zamiast rozbija si po wiecie."
Allach to taki sam b贸g jak katolicki i wicej jest w Koranie o miosierdziu ni偶 o zemcie. Wiec przestacie poddawa sie garstce popaprac贸w. A Ty Europo przesta udawa 偶e niczego nie widzisz.
Proponuje utworzenie pastwa katolickiego.musicie sie najpierw uzbroic potajemnie potem zamordowac lokalne wladze ( grzech korupcja szatan ) opanowac policje I wojsko I taka czestochowa wasza i gestapo zdrowas Mario i huzia bozia!
"tutaj siedza sami pismaki komentarzy jest 220 a lapki w gore prawie 600, rozumie sami trolle pisowskie na tym forum-:)))"
Dlaczego tego pana pokazujecie teraz bd mia koszmary w nocy i bd si moczy!
no to banderowcy dostan nauczk od Putina !!! rka noga m贸zg na cianie...
A kto to jest ten WD. stary piernik i nieudacznik.
"Miasto  Wrocaw  przez  wikszo    lat  byo  zwizane  bardziej    z  Niemcami  ,  ni偶  z  Polsk . Czy  to  oznacza  ,  偶e  dzisiaj  nie  jest  polski  ? Nie  syszaem  ,  偶eby    Niemcy  chcieli    nam  go  ukra . Do  tego  trzeba  mie  mongolsk  mentalno ."
Jaki donos na Polsk?????????????   Choroba nieuleczalna?????  Chyba w XXI wieku znajd si specjalici.
"Ten sadaz byl z pewnoscia przeprowadzony w szkole Rydzyka, albo na jakiejs pielgrzymce!"
"Pewnie Niesio chcia mu zaserwowa szczaw i mirabelki ,a tu zima trzyma i ....."
Katolik z klap w marynarce-偶enada i hipokryzja
Z nas Polak贸w si mia.
Gdzie jest to Cenzurowane z WP?.Jak to mozna dopuscic takie Plucie wsciekym jadem> nie --to jeszcze resztki POpychade.
a do tej pory bya bezstronna  nastpna idzie po pomoc do niemieckich medi贸w nie zasuguje nawet na pogard
tak jest dobrze im tak niech zobacza jak jest i zasilek im dac 500zl i niech zyja caly miesiac
"Nie tylko kilku czonk贸w rzdu uwa偶a go za wroga Polak贸w Obywatele w wikszoci te偶. Histora go osdzi, wczeniej by mo偶e te偶 kto pochyli nad nim gow."
"Spokojnie ! Zdaje si,偶e anty偶ydowski [ z manifestacji]jest  kumpel Kukitza [media pokazay ich na wsp贸lnym zdjciu!].Wic nawet gdyby zatuk nawet 偶yda to pewnie Duda awansem uaskawi i bdzie OK?"
"Zostali tylko dziennikarze tzw "" DYSPOZYCYJNI"" dla obecnej wladzy.
WYPISUJE SIE Z OGLADANIA TELEWIZJI PiS - OWSKIEJ..
Juz widac kolosalna zmiane w przekazie wiadomosci , mdlych i nic nie wyjasniajacych wywiadach. Jedyne  co powiadaja to "" Polacy nic sie nie stalo "" Szydlowa - "" to dobrze ze jestesmy teraz pod nadzorem unijnym "" Morawiecki - "" to dobrze ze obnizono nam rejting "" - eksporterzy zarobia. BZDETY I KLAMOLSTWA I PEWNOSC ZE GLUPI NSROD TO KUPI."
"nar贸d gosuje za patriotami, a zdrajcom precz z Polski.  ANDRZEJ ,BEATA ,JAREK tak trzyma."
"antonimy: czarne-biae, sur贸wka-got贸wka, dziennikarz-nocnikarz"
jds: zazdrosny??? O Pawowicz??????? :) :)  :) :) :)
Polsat jest 偶aosny.
"No to teraz bedzie tych tzw. dziennikarek z smiesznymi akcentami gwarowymi, nie umiejcymi po Polsku dobrze m贸wi. Moki. Nowy Targ, Lublin, Kielce na start"
POWIEDZ COS o PO ILE PACIO I PACI TO DOPIERO JEST FORSA
oj Debski - jestecie towarzyszu gorszego sortu
"kto wydal decyzje o nielegalnych dzialaniach? Jeszcze chodzi wolno? Gdzie? W Burkina Faso? Nie, w Polsce. Jaki wplyw na te dzialania mial specjalista od ""kupy gruzu""-klaun sienkiewicz??? Tez chodzi wolno, jeszcze????"
"miej si dalej a偶 do 5,99 za Euro"
SONDA呕 ROBIONY W KOCIELE POD AMBONA-CHA CHA CHA
PZPRowiec Dbski wida daje wod na myn lemingom...
"LEWICO SPADAJ NA SZCZAW! wstyd i haba, burdel lewacki won!"
Mata co chcielista....
by si nie kompromitowa donaldzie tym co robisz a angielskim szceg贸lnie
ludzi umoczonych w ukadach PO pod trybuna
"""Pisowski"" ciek? A Twoja wypowied藕 to niby co? Wersal? Przy takim chamstwie tw贸j przekaz jest po prostu mieszny."
"Przeciez wszyscy wiemy, ze komune obalil kacyk Jarek, nikt inny. A byl tak gleboko zakamuflowany, ze nawet go nie internowano"
"Panie Dbski nie wmawiaj ludziom, 偶e mamy ju偶 2017 rok, bo tyle to trzeba poczeka i zobaczy co PIS wykona a co nie. Kamstwami i czarnowidztwem nie poprawi Pan swojego wizerunku ""dziennikarza""."
"Ciekawe czy za darmo ycie komu przez dugi czas udostpniali cokolwiek, HIPOKRYCI!!!!!!!!!"
"a ja krzycz lechu krzycz
zamie 贸偶ko swe na prycz!"
Zrozumia wic co mu opowiedzieli miesic temu
"A gdyby inna partia wygraa ""wybory"" to oni tam by nie protestowali? Rzd ich nasa? Nawiedzeni misjonarze rabina Tuska jak nie zobacz to zawsze co wymyl..."
Ta istota to teraz bdzie przyjmowa pielgrzymk na kolanach premiera i prezydenta  Polski.
"noi prawidlowo , pani juz dziekujemy"
UWAGA!!!!!  Wikszo komentarzy pisana dla kasy na zlecenie prezesa!!!!!!!!!
"atwo jest kogo obsobaczy, oplu i nie ponosi z tego tytuu 偶adnych konsekwencji! Gdzie byli ci wszyscy oskar偶yciele Lecha gdy trzeba byo nadstawi gowy swojej i swoich bliskich? Przecie偶 kto wybiera Was na szefa SOLIDARNOCI i gosowa na Niego gdy wybierano Prezydenta Polaki!!! Wstyd藕cie si wszyscy tch贸rze i intryganci dzisiaj, po latach deptajcy ostatnie autorytety Najjaniejszej Rzeczypospolitej! Nar贸d bez autorytet贸w jest Narodem bez historii a Nar贸d bez historii nie ma racji bytu! Czy tego chcecie ndzni oczajdusze? Wysyacie dzieci aby szkaloway czowieka bezprzykadnie oddanego Polsce? Wstyd i haba!!! Do czego jest zdolna chamska nienawi i ch nieuzasadnionego odwetu maych ludzi!!!"
PO-PSL i Nowoczesna to smietnik zla
"we bie mu sie przewraca ,pseudo Polakowi"
"CO MG POWIEDZIEC ,TERAZ K..... MY"
"Niedlugo i wam sie skonczy antypolska witryna,zdrajcy!"
"""Imigranci"" molestuj ju偶 w Europie Zachodniej a w Polsce nie !!!   ZACIANEK !!"
"tyle, ze sami sie nie podali do dymisji, Po mial prawo mianowac 3 z Tk i Pis wzorem doswiadczenia swoicj licznych czlonkow pochodzacych z dawnego PZPR wprowadza slawetne  nioocne wizyty a swiatly pan od kultury , ktory niewiele rozumie z tej kultury robi cenzure, wzorem swoich pzperowskich braci........ nie mow wiec , ze pis nie robi zamachu. On po prostu nie umie i nmie rozumie, ze mozna inaczej. Masz racje tylko w tym co powiedzial Kurski, ze ciemny narod to kupi. Problem w tym , ze nie caly narod jest ciemny, choc coraz czesciej ten nie ciemny stad ucieka. Za pisu ucieklo go najwiecej...."
On si tak z Polski mieje.
Czy偶by gupota zacza zatacza coraz wiksze krgi?
W znakomitym gronie hahaha ta to ma tupet
"tygodnik 芒Spiegel芒, kt贸ry tradycyjnie lokuje swoje sympatie bli偶ej socjaldemokrat贸w napisa kilka lat temu, 偶e Angela Merkel typuje Tuska m.in. na szefa Komisji Europejskiej, bo jest 芒atwy w hodowli芒, 芒niewymagajcy芒, 芒niekopotliwy芒. Targowica"
Widocznie tak miao by.  Zasu偶ya sobie Pani.
"To jest to. Nadpremier smiejacy sie w trakcie obrad Sejmu. Widac jak jest zainteresowany, ze swoimi pieskami, tym co dzieje sie na Sali Obrad. To nie tylko buta i brak poszanowania powagi Sejmu to cos powazniejszego. Inteligent szpagatowy ze sloma wystajaca z butow."
mieje si z wasnej gupoty
Zdjcie przedstawiajce Jarosawa Kaczyskiego  i Orbana  jako Flipa i Flapa.
spadajcie towarzyszu Debski
"Dopiero teraz masz komun u wadzy, jakby sprawdzi 偶yciorysy wcznie z prezesem kt贸ry je藕dzi na szkolenia do Moskwy to by nie gada gupot."
"Reszta nawet nie zd偶ya przeczyta,a ju偶 si miali. Macie cay obraz tych pajac贸w."
Ciemnota si cieszy
"The Just One - ""czytanie ze zrozumieniem najwyra藕niej boli wyborc贸w PiS. atwiej opluwa, i oskar偶a bez dowod贸w"". W tym momencie to ty opluwasz wyborc贸w PiS. Zreszt ka偶dy zwolennik PO robi dokadnie tak samo... Uwa偶acie si za ""lepsz cz spoeczestwa "" ... Jednak wasze komentarze nie pozostawiaj zudze . Zaprzeczacie sami sobie..."
Niech si dalej partacze z nowoczesnej i popaprancy chandrycz to spadn poni偶ej 10. I tak powinno by.
"Do gar贸w zamiast pisa bzdety. Lewicka pytaa, a Gliski powinien odpowiada na zadawane pytania. Je偶eli rozm贸wca wygasza tylko swoje owiadczenia do obowizkiem dziennikarza jest mu przerwa i prosi o odpowied藕 na zadane pytanie. Tylko w rydzykowej kablowce dziennikarze s usu偶ni."
"Ta strona www, to zwyka zbieranina lewak贸w!.
Wirtualna Polska = Wirtualny kraj = Pastwo teoretyczne."
"A kim On jest aby 呕DA organizacji spotka przez IPN i to jeszcze z g贸ry ustalonymi osobami, pytaniami i charakterze spotkania.

Chce takie spotkanie (chce si oczyszcza) to niech sobie zorganizuje. 
Pastwo nie ma obowizku ponosi koszty i oczyszcza wtpliwych osobistoci.

Im starszy tym bardziej palma odbija ..."
"Przytoczyli te偶 sowa posanki Beaty Kempy, kt贸ra czy si z nimi w modlitwie.Myl ze pani Kempa powinna rozebra si do golasa przed tym teatrem to nawet ci z Krucjaty R贸偶acowej spieprzali by gdzie pieprz ronie,nie m贸wic o pracownikach i aktorach teatru,i byoby po sprawie."
"Nie dawa si 偶ydostwu i banksterom
 Nawet l.miller przyzna w wywiadzie 偶e poprzedni parlament zama konstytucj wybierajc. wiosn 5 sdzi贸w na zapas. przez po. psl.   Rzepliski do 
natychmiastowego zwolnienia . Nie mo偶na sankcjonowa takich wybryk贸w. w wykonaniu rzepliskiego i TK"
"Pis chce ogupia cay wiat, propaganda lepsza ni偶 za komuny."
mieje si 偶e dyma Polsk
No to ju偶 wiadomo skd on bierze te swoje super pomysy. pewnie teraz hitem dla niego jest ksi偶ka Hitlera
"Bolku zamilcz, bo wijesz si jak w偶.
Poza tym tylko winni si tumacz kamco...........
呕e te偶 kto taki jak ty by prezydentem Polski...."
Czy dziennikarze to wite krowy te resortowe zidokomuny to chyba tak
pewno dosta zdjcie nagiej posanki szczypiskiej
i do tego ap贸weczek?
"Porbani fanatycy religijni. Takie zachowanie prowadzi w dalszym etapie zidiocenia do przywizywania sobie adunk贸w wybuchowych wok贸 brzucha...
Przecie偶 to nie byo wystawiane publicznie np. na g贸wnym placu. Kto nie chcia oglda pornografii nie musia przecie偶 kupowa biletu i wchodzi do teatru, prawda?"
"DOKADNIE TAK.....porzucenie pracy si r贸wna bez prawa do zasiku ... fochy to u mamusi albo u cioci wasza na """
"Jest takie powiedzenie :  mieje si jak  gupek do  sera 
No comments !"
"cieszy jap, 偶e udao mu si tablet w kocu uruchomi"
"Ciekawe kto bdzie ukada teraz ram贸wki w ""TVP IS"" , bo wiadomo, 偶e ca wadz to ma mini prezes i to on dyktuje co ma PAD podpisywa i Pani Broszka m贸wi...?"
zdrajca
ej dbski gdzie ty 偶yjesz????????
"Nale偶y zrozumie ,偶e je偶eli za niecae 4 lata PiS- poniesie pora偶k ( czego jestem pewny) - to wtedy cay pisowski skad w TV-PiS podda si honorowo o偶y sam w komplecie wypowiedzenia.
PiS moim zdaniem wygra przypadkowo  tylko dlatego ,偶e posiada na licie wyborczej nr 1 ( ""niezorientowany lud"" , podobnie jak poprzednio na PSL glosowa
na t list nr 1"") , a po drugie lewica stracia ponad 12 % gos贸w ( z powodu rozbicia lewicy na kilka ugrupowa). I TO JEST CA CAA TAJEMNICA sukces贸w PiS-u  w ostatnich wyborach.!"
Facet bez prawka i konta zna si na tablecie ? Zamiast pracowa bawi si tabletem
Banderowcy oczywicie bo chca wznieci niepokoje na Krymie.
Panie Hipokryto boisz si pan opodatkowania paskich market贸w w Polsce
To tak kaczynski pracuje w sejmie?? Czyta sobie plotki na teblecie!! Hanba!! Precz z takim poslem darmozjadrn nierobem!!!!
Jak w Europie porzdnie po gbie nie dostan to si nie wynios .To dosownie i w przenoni .
"CMY I NIETOPERZE ZERUJA PO NOCY.
NASZ RZAD JEST TYM SAMYM."
PIS atakuje ale tylko jedna strone bo wg PISu podsuchiwanie polityk贸w tylko jednej opcji czyli PO to wg kaczyskiego jest w porzdku. Czy ci co podsuchiwali polityk贸w a wiadomo wszystkim dookoa kto mia motyw robili to zgodnie z prawem.? Czy suzby odpowiedzialne za brak zabezpiecze odpowiadaja i ktokolwiek z tych suzb zosta skazany za niedopenienie obowizk贸w. PIS musi zniewaza wszystko i wszystkich dook贸la a potem twierdzi ze to nie my a Polacy. Zakamanie 偶e szanuja demokracj w tym PISie jest przebrzyde.
"Cieszy si, 偶e tylu ogupionych polak贸w tak skutecznie i szybko okama i zrobi w ciula !!!!"
"Zatrudni ""dziennikarzy"" z telewizji ""Trwam w nienawici""."
zobaczy swoje odbicie w tablecie
"no ja kto co , zrobi test na inteligencje"
"Oj lepiej ,ze nie pk ...bo mielibymy  podw贸jne miesicznice ."
rozsmieszyl go  zimny lech.....w tvp piss  !
"i pomyle 偶e na takich bandzior贸w i Polska paci, daje ukrainie co roku bezzwrotne po偶yczki/ostatnio 100 mln euro od Kopacz/ oraz wspiera wojenk miliarder贸w posyajc tam na bombardowania codziennie /ostatnio noc/nasze samoloty ?"
"Do jasnej cholery !!! Jakie pastwo islamskie ?????????????? OBKANE ISLAMSKIE BESTIE, PUSTYNNE PSY SZATANA - TAK NALE呕Y ICH NAZYWA !!!!!!!!!"
Tak wanie pracuje Kaczyski i my na niego pacimy nic wicej nie trzeba pisa jego zachowanie w  pracy samo m贸wi za siebie. Dla mnie to niezr贸wnowa偶ony czowiek kt贸ry jest u wadzy. Pora wysa  go w XVII wiek bo tam go widz a nie w moim demokratycznym kraju.
"Paka po niej nie bd. Hasta la vista, baby :-)"
ten trzeci to taki maly kolo co sie we wszystko wp ... ala choc nic nie wie . pewni ludzie w Polsce zbawicielem go nazywaja .
jaja sobie robi z tych co na nie go glos odali
"c贸偶 za powaga podczas wykonywania swoich obowizk贸w su偶bowych, w dodatku w trakcie gosowania... 偶enada"
Oddaj zoto wermachtowcu
a ty Lolkiem ?  a moze to Jacek i Placek(ten drugi)
No i w sumie dobrze 偶e ona odchodzi bo saba z niej dziennikarka. Swoj decyzj pokazuje swoje sympatie polityczne a dziennikarz musi by obiektywny! Mo偶e w MC donalds znajdzie sw贸j cel zyciowy!
"Panie Stankiewicz wydawao mi si do tej pory ,偶e jest pan bezstronnym dziennikarzem,ale .....tylko mi si wydawao...."
PEWNIE ZACZ SI MIA BO DZIE WCZENIEJ KTO MU OPOWIEDZIA MIESZNY KAWA A ON DOPIERO ZAJARZY
"oczyscic media ze zwolennikow zlodziejskiej PO.Psl,ktore niszczyly PiS.Brawo PiS czyszczic do konca-praca w marketach czeka na marnote dziennikarska"
To on umie obsugiwa tablet??? Dziwne!
DUDUS POWIEDZIA ZE ON RZADZI
"Czy kto askawia zada sobie trud por贸wnania nauk Mahometa z Judaizmem, a co za tym idzie i z czsto starotestamentaln logik Chrzecijastwa? Pierwszymi uczniami Mahometa byli wyznawcy judaizmu, a jego koran to nic jak 'udoskonalona wersja' prawa moj偶eszowego i naszych tak choubionych 10-ciu przykaza. Gdyby nie reformacja i rewolucje obyczajowo- socjalne, niewiele bymy si r贸偶nili w tej kwestii od muzuman贸w. Wicie krytyski patriarhalizm ale w caoci, bez wzgldu do kt贸rej z trzech religii inspirowanych Moj偶eszem si to tyczy. BTW w Polsce mamy katolski shariat, gdzie typowa kobieta musi harowa drugi etat w koo m偶a i gromadki dzieki- to s zalecenia Katchizmu Kocioa Katolickiego."
"szkoda s贸w, zakamanie nie ma granic, Bo偶e chro Polsk, bo inaczej ci ""pseudokatolicy"" j zniszcz"
"wystarczy przeczyta, POprzednie artykuy tego pseudodziennikarzyny debskiego, ( celowo z maej) 偶eby zobaczy jego poziom wypowiedzi, przeciwnikom obecnej wadzy, zale偶y na cigym podjudzaniu POlakow na siebi, PO rzdzio 8 lat z 偶adnej obietnicy si nie wywizao, pucili ludzi w skarpetkach, okradli o godnym 偶yciu na emeryturze, zabierajc kas zgromadzona na OFE, gdzie wtedy byle debski!??"
"jakby chcieli to zrobili by porzdek w 24 godziny ale nie chc wol aby niewinni ludzie cierpieli , nie powinni si pier.....oli tylko z grubej rury i po zawodach , wielkim bdem  byo pozwolenie na powstanie pastwa islamskiego a teraz maj kopot , a angela niech zabierze do siebie wszystkich uchod藕c贸w bo Polska ich nie chce .............. , nie sta nas na utrzymanie darmozjad贸w ............."
Raczej ty ja posiadasz skoro nazywasz siebie gorszym sortem. Nie potrafisz zrozumiec kontekstu wypowiedzi Kaczynskiego ( jezeli sluchales wogole tego wywiadu) czy po prostu nie umiesz samodzielnie myslec i odbierasz wszystko 1 do 1 co ci powie tvn ?
spali meczety-bdzie spol贸j
teraz widzicie do czego sa zdolni pobozni piszczykowie.
Hanna Lis to dla niej znakomite grono ! Bardzo dobrze ze ja wyrzucili !
do komplett powinni zwolnic Kurskiego
"Wef kuper, kaczki maj kuper. Zad to mo ku raczej."
"tedy, gdzie to wyczyta? Sam tego nie wymylie. Nie dziwi ci 偶e bliscy ofiar z innych partii nie maj wtpliwoci co do tego 偶e to by wypadek, splot nieszczliwych i nietrafnych decyzji. Kaczyski i Macierewicz te偶 o tym doskonale wiedz a bajk o zamachu wymylili na u偶ytek takich jak ty."
"WIRTUALNA POLSKA JESTECIE  WREDNYMI ANTAGONISTAMI,WROGAMI POLSKI 呕EGNAM WAS MEDY REDAKTORSKIE...zmieniam portal"
"Tylko baran i gupek pluje w swoje gniazdo, a mo偶e krol Jagiello tez kolaborowal z Krzyzakami co???!"
A wystarczy powici t wod i 偶aden... tam nie wlezie...
....wida nad czym rzd bdzie pracowa.... niejedna posanka to moga by i czym innym powali je偶a.......
Nie m贸w za wszystkich m贸w za siebie
WSTYD I HABA TO KRA< NISZCZY LUDZI A NA KONIEC TAK JAK LIS LATA DO NIEMCW NA SKARGE
"Uwiceni czonkowie klanu Kaczyskiego zrobi porzdek z bezwstydnymi sztukami teatralnymi, zbyt swobodnymi pisarzami, dziennikarzami krytykujacymi kacz rewolucj. Tak na by. Tego chcielimy, gosujc na PiS.  Przyjdzie czas na inne dziedziny 偶ycia. Polska scena komiczna polega na tym, 偶e ludzie modl si przed teatrem zamiast w kociele. Mo偶e i racja, bo kocioy coraz czciej zajmuj si handlem i pokazywaniem ""baszobor贸w"", co mo偶e wkr贸tce zastpi teatr w og贸le. Przepraszam za finaln rad: nie uczestnicz w tym, co mi nie odpowiada, lecz nie domagam si likwidacji teho, co mi nie odpowiada. mieszne,"
zobaczy jak kartofel rozprys si na betonie.
"Lewicka dobrze prowadzia program, to Gliski zachowywa si jak CHAM i nie chcia odpowiada na pytania, mci i zachowywa si agresywnie ubli偶ajc tej dziennikarce. Dziennikarz jest od zadawania pytania, tak偶e tych trudnych, a polityk kt贸ry jest na usugach spoeczestwa kt贸re go wybrao ma OBOWIZEK rzetelnie na te pytania odpowiada, a nie zachowywa si w spos贸b arogancki. Tym PIS-owcom od wadzy si we bach ju偶 poprzestawiao, uwa偶aj si za nadludzi. Lewicka na pewno znajdzie prac w prywatnych mediach, bo powtarzam to rzetelna i dociekliwa dziennikarka. PIS-owcy uwa偶aj 偶e dziennikarze nimi manipuluj, ale gdyby racja i prawda byy po ich stronie to naprawd nie musieli by si niczego obawia... Nie ogldam ju偶 TVP, bd oglda prywatne stacje a nie PIS-owsk propagandow TVP."
pewnie czyta kaway o sobie
"Dlaczego si nie bronicie przed dyktatur.... gupi ludzie. Niedugo bd wam m贸wi jak caowa si z 偶on aby byo poprawnie, pobo偶nie, tak jak sobie g贸wnodowodzcy wyobra偶a.. ndza nad ndzami."
lep na tpy lud
Separatyci przestrzegaj rozejmu a to dra偶ni bandyt贸w ukraiskich
"podobno sa prowadzone rozmowy z ks. Rydzykiem ?Czy to prawda? ,ma on wejsc na antene za redaktora  Krasko?!"
NA RESZCZIE   BOLKOWI   POWIEMY   SKONCZMY   ZE   ZDRAJCOM   RAZ  NA   ZAWSZE    HA   HA  HA  HA  HA   HA    ALE  HISTORIA   Z   DZIEWCZYNAMI   SUPER  !!!!!!!!!!!!!!!!!!
"sie dowiedzia 偶e kot to nie kot a kotka i wanie zosta ojcem 8 (omiorga) dzieci ( 8 x 500 = 4000 z.) Ja r贸wnie偶 bym si mia ""do rozpuku"""
Ta dzienikarka 偶ydowskiego pochodzenia zawsze mo偶e wzi KREDYT przebranzowic si -fryzjer ps贸w i pracowa do 67 roku 偶ycia lub do mierci
"Problemem jest ustawa, Rzepliski wycignij gow z d... Tasaka i zablokuj ustaw ze wzgldu na niezgodno z prawem unijnym, bo mimo jednego plusu kt贸ra daje ta ustawa jest te偶 milion minus贸w, kt贸rych kr贸tkowzroczno ludu nie widzi, ale nie napisz bo ju偶 pewnie szpiEguj m贸j komputer."
"piszac swoj komentarz anonimowy mlodziaczku ty jestes smieszny w swej opinii. Mozesz buty czyscic takiej legendzie na calym swiecie jakim jest p.Walesa. Innego Polaka swiat nie zna jak p,Walese. Dzieki jego walce z komuna mozesz pisac anonimowo i jest wolnosc slowa, ale nie wierz o tym bos mlody i ......"
Jak dosta tableta i odkry jego istnienie to pewnie rechocze z ka偶dej gupszej reklamy.
co sie martwicie mohery przed wami jeszcze 3 i p贸 roku zajebistych zmian
"Kiedy wreszcie dotrze do was ludzie, 偶e ka偶da religia to narzdzie pewnych grup interesu do zdobywania pozycji i skubania was z kasy. Wszystkie religie powinny by zakazane. Islam dzi jest jak chrzecijastwo w redniowieczu. 呕eruje na niewyksztaconych smoluchach. Meczety i kocioy powinno si przerobi na szkoy i uczy ludzi o wiecie zamiast uczy ich jak interpretowa stare ksi偶ki pene sprzecznoci i bajek."
Kto go nauczyl uzywanie tabletu?/
"trzeba wreszcie spojzec prawdzie w oczy =WSZYSTKIE RELIGIE SA ZLE I SA ZAKALA CYWILIZOWANEGO SWIATA.
nie ma dobrej religii -sa tylko zle i jeszcze gorsze."
"Kukiz niekumaty zosta na sali z swoimi ""Narodowcami"""
mia si z takich samych os贸w takich jak ci co nie lubi PiSu
Osun wszdzie od koryt PO i PSL antypolskie organizacje i to NATYCHMIAST   wykorzysta wsp贸prac Kukiz 15 a nawet cz ludzi z SLD bez napanej hooty i palikopetruciarni
no a z czego sie moze smiac stary kawaler z kotem ...
Od niej powinni zaczac:) to taka opetana persona ze tv  trwam powinna z nia reality show zrobic cos w stylu egzorcyzmow na zywo a prowadzacym moze Miszczak z tvn. Albo ten z mucha ze strefy szabanacie.
"Jak to co? Wszystkiemu winne s kobiety. Chodz i krc tymi tykami, 偶e ka偶demu normalnemu chopu m贸zg staje."
gdybys kolezanko wychwalaa pod niebiosa jedynego prawdziwego Polaka to bys pracowaa w TVP
Jego wzrost go bawi.
Czy platforma trzymaa by kret贸w PIS?
Przecie偶 caa Polska z nich si mieje . Komunici i zodzieje.
"Nie bdzie Kraki, bd ZDROWAKI."
Pan Maciarewicz uwaza za   honorowe doprowadzeniedo katastrofy przy ladowaniu wbrew zreszta obsludze lotniska. Braak kwlifikacji uwaza za dowow do dumy. POGRATULOWAC NONSENSU PANU NIE MAM ZMIARU. jest to glupia szkodliwa propaganda.
Musimy pogoni zodziei z PiS...;
przykre 偶e oceniasz innych wedug siebie - nie ka偶dy jest sprzedajny jak ty i twoi kolesie peowcy i zacofani
"dla Pana Jaroswa wszyscy Polacy s przystawkami,chyba 偶e gosuj na niego to wtedy s gupim ludem"
"Zobaczy ser z ""Biedronki"""
Ten si mieje kto si mieje ostatni. Zobaczymy po jakim czasie czy bdzie mu tak zabawnie.
"wanie tam, to wanie tam dziaa Tatarzyna, kt贸remu polscy sugusy frau Merkel zwani dla niepoznaki PO dali na dziaalno bandyck 1 mln euro"
"""NAS""??? czyli ...""resortowe dzieci"" ?????
i susznie..... czas ... 偶ebycie ...偶yli jak przecitny Polak ...
z 1200 z ...w zamian za ci偶k prac...
albo zupenie bez dochodu jak 3 mln Polak贸w ...kt贸rym si wmawia, 偶e nie ma w Polsce bezrobocia !"
BRAWO PANIE RYSZARDZIE NIECH PAN NAS RATUJE OD TYCH CIEMNIAKW NIE ZNAJACYCH SI NA EKONOMIIIIIIIII.
"TO JEST GODNE ZACHOWANIE PREZESA,WSTYD"
"czym ciemniejszy lud tym atwiej mu naobiecywac  w Egipcie te偶 m贸wili 偶e zacmienie to kara dla nieposusznego /ciemnego/ludu   
teraz tylko bd komisje z wiadomym wynikiem i miesicznice ciekawe czy te偶 zmarych ze swoich rodzin odwiedzaj co miesic ?????"
偶e IS ronie w si to na rk Asadowi? co autor bra?
"Po co tylu dziennikarzy,spiker贸w w TV. Wystarczy jeden jak w telewizji P贸nocnej Korei przekaz bdzie rzeczywisty i bez zakama."
"To pan Schulz nie wie ze krytykowanie dzialan politycznych innych panstw  maja tylko Polacy?????? Jedyni sprawiedliwi i wszechwiedzacy,tworcy najwspanialsze demokracji swiata????Ze nikt, ale to NIKT na swiecie nie ma prawa krytykowac polakow????"
"PIS dlugo nie rzadzi wiec trudno wymagac,zeby wszystko  bylo zrobione,ale....
Mogliby zakanczac projekty,ktore zaczeli! Teraz zrobili ""rozpizdziaj""!
500 na dziecko,emerytury,kwota wolna,12zl i co? NICZEGO nie skonczyli!
Zajeli sie sprawami,ktore w miernym stopniu interesuje spoleczenstwo.
A przeciez wiadomym jest,ze wiekszosc ludzi glosowala na nich ze wzgledu na te projekty o ktorych napisalam na poczatku."
Brat i bratowa jeszce nie ostygli w robie zamordowani przez ruskich w Smolesku pod Katyniem a ten si mieje..
PIS to tylko habi  Polsk
Teraz to on sobie mo偶e... Na pewno jest odpowiednio 'sczyszczony' z teczek i teraz kozakuje. 呕enada.
Pewnie wolisz bajk Jedrek i Beatka
I bardzo dobrze !!! Jeli pracowaa przez 8 lat to na pewno jest umoczona.
"偶eby uporzdkowa su偶by to trzeba pracy w systemie czterozmianowym, ca dob a nie tylko w nocy, nie kombinujcie..dzieci w przedszkolu rozumiej problem"
"Nie ma na co czeka, trzeba ci r贸wno z ziemia"
"""ela - o, to jest gboki komentarz (zwaszcza w kroku). Ciekawe co powiesz, jak zaczn tu napywac w liczbie  2 milion贸w, wczeniej wywoawszy wojn, bo nie lubia Rosji."
"Moze na tle nerwowym ,reaguje smiechem."
"""znakomitym gronie""?! ""dziennikarzy""?! Oni tam pij w tej TVP?"
W ramach inwigilacji obywateli chyba wszed na prywatn poczt zakochanej pary i czyta miosne wyznania. Niech si uczy samotny biedaczek.
"prezesa rozbawi kawa w jzyku angielskim, ale tylko do czasu
a偶 mu ""rysiu czarniecki tumacz"" przetumaczy na polski."
Nie dae rady znale藕 na pilocie tego czerwonego guzika?
no to po偶artowae przy sobocie
"muzumanie, wynocie si z Polski, na zawsze, nie chce tego co jest w Niemczech"
to on umi tableta u偶ywa? szacun!
Po prostu idziemy PIS-du :-) My Polacy Aborygeni Europy ... oszczaj nas za niedugo wszystkie psy i koty. Tak偶e kotek PREZESA DUCE!
Moherowe boj贸wki zostay rzucone do ataku. A to dopiero pocztek.
"Jak na sonda偶 przeprowadzony w Jachrance na grupie 235 ""prawdziwych Polak贸w"", to strasznie mae to poparcie."
Broni Lisow Lewicka Krasko  czyli przyznaje sie ze robila to samo klamala
I nie WRACAJCIE tu wicej !!!
"No a co ze sciemnianka , ze niemal wszyscy mieszkancy Krymu to tatarzy i ukropincy ?
Swoim prad odlaczaja ???
Nie robcie z siebie debili - nie mo偶na siedzie na dw贸ch koniach jednoczenie ;)))"
"Ten sonda偶 to robi chyba gimnazjalista na lekcji religii i tak dosta  pa  bo soce  Tatr jarekpolskezbaw nakaza  65% poparcie ,tylko patrze  jak cae szefostwo CBOS do wymiany ju偶  w nastpnym  tygodniu."
byo nie byo ojciec dyrechtor ksztaci kadry wic gdzie je trzeba upcha...
"Na p贸wyspie Krymskim powinno powsta nowe pastwo Tatar贸w. Ruskie i ukraice
z Krymu wont."
"Antek ty przestan bredzic.
Jaka Armia taki MINISTER OBRONY."
Kaczoryzm pen gb
