"Zmiana ordynacji wyborczej oznacza tylko jedno. Wolno bdzie gosowa na jedyn suszn parti, czyli PiS. Powsta narodzie i przepd藕 t band oszust贸w. Duda nie ma honoru, oszukiwa wszystkich by zaapa si na stoek, a ogupiony nar贸d to kupi. Jak dugo jeszcze damy si tak dyma bandzie oszust贸w?"
"debski, db najlepiej nadaje si na koi do ogrodzenia a nie pisanie"
"wszystko wam 偶le, prezes pacze- 偶le, mieje si- 偶le, modli si, spotyka w nocy, spotyka w dzie, przemawia, nie przemawia, nic nie m贸wi, m贸wi- itd. itd. a oni i tak jest sprytniejszy r贸偶ne cieniasy i ...... od was wszystkich miernot, ha ha ha."
Propaganda si zaczyna to poparcie to chyba tylko u kleru.
a ty ju偶 jeste na tyle wa偶ny aby innych poucza?
"a ja wsp贸czuj tej kobiecie. Widz jak si czsto z偶yma , jak sie mczy ,wida to na jej twarzy na pewno przepaci to swoje premierowanie zawaem albo inn chorob."
"O m贸j Bo偶e ,nastpna afera sfabrykowana przez pisl@mist贸w."
Pisiory juz zaczynacie swoja propagande. Smutne to
"4 lata? Chyba nie wyrobie! Po tych 3 miesiacach mam wra偶enie 偶e 偶yje w jakim psychiatryku a nie cywilizowanym kraju, w rodku europy! PIS - najwiksza zakaa normalnej Polski!"
"A dlaczego niby nie mia by o tym m贸wi ??? To jakie tabu ???  I, to nie bya jaka katastrofa - zamach to by....ciule..."
Pali co dobrego
pewnie kto napisa mu 偶e jest inteligentny i parskn miechem
Jak sprzedawal stocznie to nie informowal UE a teraz jaki aktywny !!Nao偶y sankcje na niego w Polsce za przekroczenie szybkosci za wszystko inne nka do prokuratury!
TrzebA JAK NAJSZYBCIEJ NAPRAWIC BLAD HISTORII I WYSLAC KACZORKA TAM GDZIE JEGO MIEJSCE POWINNO BYC PRZYNAJMNIEJ OD 10 LATEK.
"Ludzie wszystkich krytykujecie a sami jak bawoy dajecie si prowadzi PIS, osy dzi k贸ko r贸偶acowe bdzie decydowa o telewizji. Dobrze 偶e lubi du偶o czyta program 1 i 2 nie  jest mi potrzebny.呕ycz powodzenia"
"Tadla wr贸!! Co to za baba dzisiaj prowadzila Wiadomosci? Wida ze jakas wredna, az musialam przelaczyc"
Biernacki kury maca na nocnej zmianie!!!!!!!!!!!
Nie ma ani jednego po-wca kt贸ry m贸wi prawd wic znowu bredz !
"Polityk贸w rozliczymy przy czym co do lepu to PO-PSL nie spenio 偶adnej obietnicy wyborczej mimo 偶e miaa 8 lat na to. A nawet wrz przeciwnie : obiecali nie podnosi a nawet obni偶y podatki w gospodarce a je podwy偶szali nono stop.
Daltego artykulik z wirtualnej odbieram jako typowy kwik lewackiego mainstreamu internetowego."
"Maz dzisiaj oglda mina 20
A ja sucham i mysle ki diabe chop zgupia i trwam ogada ? Osupiaa patrz ze to TVP info ..."
Miejsce Tatar贸w jest na stepach Mongolii.
Co za bekot jaspios!!!!!!!!!!!!!!!!
A co na to Rysio Rwie Swetru ???
"Jak to ??? Przecie偶 to DYSKRYMINACJA. To tacy dobrzy biedni ludzie. Chc ""ubogaci kulturowo"" ksenofobiczne niemki a one nie chc. To偶 to rasizm. Skandal. Co na to Petru? Czy KOD ju偶 zorganizowa manifestacje ???"
"Cholera ,nie ma co czyta -prostactwo i ignorancja wr贸cia na chat ,czy偶by ju偶 nikt nie dorzuci 50gr do kupna  piwa? bez odbioru ,szkoda zdrowia"
Wanie dae dow贸d swojej normalnoci o kulturze nie wspomn. No c贸偶 wielu  urodzonych w kartoflisku tak ma
jak wyszli to juz najlepiej by nie wracali-nigdy!!!
Oj to byo cos innego chyba jaka babka bo tablet si cauje !!!! Bywa i tak jak si nie ma kogo !!!!
"Brawo Tusk! teraz wszyscy si dowiedz jak rol penisz w Brukseli, agencie..."
a ty ta wypowiedz z google translatora wziales ?  skad maniek jestes ?
"Pawe, jego alotropowa odmiana POmunizm. To by tzw ""cichy totalitaryzm""."
tusek si uaktywnia bo powstaje komija Smoleska no i cela stygnie
A prezes jak zwykle w sejmie...rechocze...
"Wicie, rozumicie, tarzyszu Biernacki, do dzi macie amnezj...AMBER GOLD! Do wide, z po偶ytkiem dla spoeczestwa."
"TAK TRZYMA,DAMY RAD---KIEDY RESTRUKTURYZACJA TEGO WYMIARU nieSPRAWIEDLIWOCI?????A CO ""GRU"" TOWARZYSZ BALCEROWICZ NA TE SONDA呕E?????"
"Bardzo dobrze, 偶e odesza ""dziennikarka"" z noeprogresywnego rodowiska. Typowa aktywista GW, kt贸ra z aktywizmu 偶yje. Ona jest z pokolenia Marzec 68, KORu, UD, UW, PO a teraz .Nowoczesnej i KODomit贸w."
Smieje sie z ludzi i ich komentarzy na forach internetowych np. na WP.PL
"do jak ju藕 - szkoa podstawowa si kania ha ha ha, piszemy JAK JU呕 ale maj dzieci resortowe umiejtnoci, strach si ba ... asd"
"Straszliwie zapracowani ci nasi wybracy narodu. mia si z wasnej gupoty. A juz mylaem, 偶e to bufon, kt贸ry nie potrafi mia si z siebie samego."
Smieje sie jak mae dziecko- wie pan co??  wstyd!
a mnie si zdawao 偶e mia si z Tuska???????
"To byo inaczej - POdobno Rysiek Petru dosta reprymend od Leszka , kt贸ry mia POwiedzie - Jaki z ciebiekurna  Rysiek lider opozycji jak nie POtrafisz go d. zastrzeli Kaczyskiego ..?! A oni wszystko przeinaczyli ze wzgldu na tzw. POprawno POlityczn ...."
Powinni siedzie a nie sobie odchodzi.
siebie zobaczyl...
Hahahaha wydymali solidarno bez myda ale to dopiero pocztek dostali wadz i maj w d...e swoich wyborc贸w CZAS Wyj na ulic i ich przegoni fanatyk贸w PiS i Kaczyskiego ludzi bez krgosupa moralnego
Allach to taki sam b贸g jak katolicki i wicej jest w Koranie o miosierdziu ni偶 o zemcie. Wiec przestacie poddawa sie garstce popaprac贸w. A Ty Europo przesta udawa 偶e niczego nie widzisz.
przecie偶 to skandal  nad skandale  wiadomo 偶e to prawdziwi polacy pisowskie/
Zegnamy stary ustroj i pseudo demokracje. Teraz juz nie bedzie gwarancji pracy na zawsze bo sie jest z partii lub broni sie jej interesow. Te czasy minely. Teraz liczy sie ciezka praca i inteligencja. Nie ma miejsca dla obibokow i ukladowcow.
Sunniccy Islamici Tatarzy pokazuj prawdziwe oblicze. Trzeba wywali te terrorystyczne ze z Polski.
"Jaka kpina????? To ma by tradycja???? W takim momencie wyczam dany kana i patrze z dzieckiem na bajki. Proponuj podj leczenie psychiatryczne caemu zarzdowi i odpowiedzialnym za ram贸wk programow. Dajcie co nowego, a nie tylko jaki kevin. 呕AOSNE!!!!!!"
"(Bolku)Waeso jeszcze 偶yja ludzie kt贸rych oszukaes i wiedz dobrze co zrobies ,czas nadszed aby nar贸d w kocu dowiedzia sie caej prawdy o tobie !!!
Wszystkie tytuy i nagrody zostana ci odebrane !!!
Nie zasugujesz na nie sprzedawczyku !!!"
"Tatar贸w przesiedli  - na Ukrain i niech tam,偶yj  dop贸ki prawy sektor ich nie zaatwi"
"Schetyna POwiadomi UE, to zdelegalizuj PiS i mia si bdzie Grze."
moherze ! sami bdziecie j sobie oglda !!!!
Rozumiem 偶e oglada na pastwowym tablecie w czasie pracy za kt贸r pac mu podatnicy jakie durne artykuliki Z TV TRWAM i filmiki typowo rozrywkowe. Tak sie w PISie pracuje ale to chyba jest okradanie spoeczestwa.
Do Polak gorszego sortu:Naprawd nie masz si czym chwali a powiniene si wstydzi
podobnie byo z wyborami ! jak przegrywali to na pewno byy sfaszowane a jak wygrali to triumf demokracji !!!! to taka moherowo pisowa retoryka !!!
"niszcz i bda niszczy, kwiczenie ruskich nie ma 偶adnego znaczenia"
Ten niby minister wyglda mi na araba -to jest gro偶ne ?
Szkoda panie kukiz 偶e pan wtedy jeszcze w gacie robi na podw贸rku. Chciabym zobaczy jak pana historia by ocenia i co pan by zrobi. Bo dzisiaj dobrego zdania o pana caoksztacie nie mam dobrego. Wstydziby si pan taj krytyk i dewagacj snu
Komentowa masz prawo prywatnie a nie robi z tym wywiady
"Czy jeszcze kto ma wtpliwoci jakim zdrajc s Tusk, Biekowska i ich towarzystwo?"
we偶 bolszewia kredyt i za贸偶 dziaalno.
"Po wydarzeniach w Kolonii jako nie syszaem gosu polskich feministek - zwaszcza tych o ""marszu szmat"" potpiajcych tych zdziczaych facet贸w dopuszczajcych si czyn贸w lubie偶nych wobec kobiet. Gdzie byy m.in. kazka szczua, patek i inne gadzin贸wki ?!"
CHOLERNA LIBERALNA  ZARAZA KOMUNISTYCZNA  !!  PRECZ!!!
Aj waj nu nasze ludzi si boj na czele z Kosk-Bosk i Kopar
"Z czego gupi si miejecie, sami z siebie si miejecie !!!"
"Najpierw ""Golgota Picnic"",teraz znowu protesty.Az strach sie wybrac do teatru zeby nie oberwac krucyfiksem po glowie.Zyjemy w wolnym kraju,jesli nie chca tego ogladac,niech nie ogladaja,kazdy ma prawo wyboru."
ZAGRO呕ENIE DEMOKRACJI ! to byy harce klaun贸w z Psl-u i np. minister Nowak w rzdzie PO dzwonicy do dyrektora skarb贸wki z zapytaniem :  co zrobi aby unikn kontroli skarbowej w firmie 偶ony !
p贸 min reklam przed Kaczyskim ???? pie...ole nie ogldam
"Wp ma ju偶 pisowski zarzd. Teraz tylko bda wyssane z palca a waciwie z 偶oliborza bajki o PO, Petru czy PSL A PIS i Kukiz bd wychwalani. MASAKRA. Sprzedajne wp."
"ALE呕 WIOCHA,GDZIE JA 呕YJ JAKIE ORGANIZACJE R呕ACOWE NIECHAJ SI MODL W KOCIELE A NIE PROTESTUJ PRZED TEATREM,WSTYD I ZACIANEK EUROPY."
"Mam pytanie do ""polaka"" i ""polo"". Czego chcecie od Schulza, jestecie sto razy gorsi od niego."
Tusk powinien p贸 roku popracowa w kibutz...
"a mo偶e pozabiera im te tablety i kom贸rki , niech si darmozjady wezn do roboty, a nie robi cyrku z tak powa偶nej instytucji jak jest Sejm. Zreszt dziki takim (p) osom jest to chyba najwikszy cyrk na swiecie"
Spojrza w lusterko???
Miaa by sensacyjna wiadomo a tu wyskakuje jaki Dbski. Kto wie kto to?
"wida ,偶e UPAdlina nie jest zdolna by samodzilenym krajem. Tak rzdz lokalni aparatczycy ze swoimi prywatnymi ""armiami"" najemnik贸w"
Lechu pozdrawiam.Nie przejmuj si.Gupich maych ludk贸w  jest bardzo du偶o.
I tak trafi pod Trybuna
"Przykre, facet oderwany od rzeczywistoci.  Bromy si przed PiS."
MWISZ O TYM CO WIDZISZ TERAZ W LUSTRZE - brawo za taki przypyw samokrytyki !
"Oczywicie, 偶e ma prawo krytykowa polski rzd, podpisalimy traktat akcesyjny.Trzeba bylo nie wchodzi do Unii, byoby po sprawie. Proste.Ale nasze klamczuchy nie chc przyj tego do wiadomoci i udaj , 偶e nic si nie stao."
"To jest 偶enujce!!! I to ma by mieszne!?!?!?!?! Nieroby jedne. Podobno sejm to ci偶ka praca. Wanie wida, jak oni pracuj. Maj zwykych szaraczkw w....e. to wanie  z nas si miej, bo i tak zrobi co zechc. Masakra jaka."
pajac ~kopl  ile ci pac
Oszczedz wstydu...Nie osmieszaj soleczenstwa swoimi glupimi wywodami..
Po co azisz do kocioa!!!
Ten sonda偶 by robiony chyba pod siedzib KC PPR=PIS. Niemo偶liwe aby Polacy nie mieli rozumu. Po wpisach wida peno patnych PiS-owych hejter贸w. Na to traci nasze podatki PiS.
Kto m贸g to pisa tylko katolicy pisowcy.Tylko oni umiej straszy.
mieje si z nas tych kt贸rzy dali si nabra na ich obietnice 偶e mo偶e robi to co chce wprowadzi co chce bo i prezydent podpisze co on bdzie chcia. Ot tumany
"Orban odpisa do Jara. Napisa, 偶e Jaro ma takie pikne oczy i tak dlikatn sk贸r tu i tam..."
Chrystus i M Boza  wie ze Walesa to szlachetny i  bohateriPOLSKI ISWIATA!!  i   super  katolik..a ci co go oczezrnija maja  nie jedno na sumieniu....rodzinka     ubecka i  gnojkow
a kiedy wywal z TVP pro banderowskie dziennikarki tj. Bojke i Stepan?No chyba 偶e rzd PiSu jest tak偶e pro banderowski...
"Hura wraca normalno !!!
Dosy z chamstwem w mediach publicznych !!!"
a kaczkowski sie smieje z ciemnego ludu
Skd oni nabrali tyle moher贸w w jednym miejscu.
Oglupione propaganda kaczora tw balbina a ojciec kaczora to tw .......
呕eczywicie super towarzystwo do dumy jeden kamca lepszy od drugiego.
Malowa do STASI a teraz kapuje w Brukseli.
kto nie ma seksu w domu to niech sobie w teatrze pooglda ojej ...a swoja drog to troche 偶enua.....
偶eby zdj gacie i rozpi pasek od stanika nie trzeba  umie czyta i pisa ... prosze pana ?????  !!!!!!!!!!!!!!!!!!!!!!!!!!!!!!!!!!!!!! a tak na koniec takie male kredo najgorsza gupota to nie ta z braku wyksztacenia tylko z braku dobrego smaku
"A mo偶e to nie byy gro藕by, tylko szczere 偶yczenia, kt贸re podziela znakomita wikszo Polak贸w?"
"Nie wysilaj si Im Dbski. Przyjrzyj si najpierw ""manipulancie"" obietnicom PO-paprac贸w , kt贸rych nie chciao im si realizowa przez 8 lat - mimo, i偶 w kasie pastwa byo jeszcze w贸wczas sporo ""grosza"" . Dopiero po upywie 8-miu lat (danych PIS-owi) bierz si chopie za rozliczanie ich z danych w 2015 roku - obietnic . Wtedy bdzie czas na por贸wnanie dokona .. jednych i drugich."
Dwa kr偶ce neurony w morzu mezogleju wreszcie si spotkay i si umiechn!
Gangsterka PO?????
I  PO tym wanie PO- znaje si ten 2 sort .
Z trzeciego sortu kopytnych .
Super widocznie si nachapaa i ma dosy .ciekawe kto j sponsorowa.
pewnie widzia jak na nieodnie偶onym chodniku Donald wywija ora
"Z sekt prezia musi by ju偶 naprawd cienko. Pranie m贸zgu za wielk kas w Jachrance nie specjalnie si wida udao. Poziom hejtu jest ju偶 tak ndzny, 偶e 偶aden KOD jest ju偶 niepotrzebny. Sami odstrasz od sekty ka偶dego kto potrafi czyta ze zrozumieniem."
Przeczyta deklaracj Lisa 偶e jak wr贸ci do TV to zacznie opluwa PO
A MO呕E JEJ DOBRZE ZROBI JAKI CHOP I TERAZ MIEJE SI JAK ZAKONNICA JADCA BEZ IODEKA NA ROWERZE
"Kiedy Kurski szurnie z TVP cay desant tevaenowski z przed lat? Dzisiaj znana z jadowitoci Os /l/ ica  szaleje w Tvp info , mam nadziej, 偶e jutro ju偶 jej tam nie bdzie. Jej widok i jej jazgot jest nie do zniesienia nawet  przez widza nie majcego idoli politycznych."
"OTO NOWY PROGRAM TELEWIZYJNY NA 2016 zafundowany przez PIS \TELETURNIEJE \ R贸偶aniec z gwiazdami\ \ Jaka to modlitwa\ \ Jeden z dwunastu\ \ Szansa na odpust\ \ Od Torunia do Opola\ \ Miliard w Ambonie\ \ Diecezja nale偶y do ciebie!\ \ Berety do mety\ wycig i w habitach \ Jedno z dziesiciu przykaza\ \ Najsabsze ogniwo\ - krotki poradnik z cyklu sam napraw sw贸j r贸偶aniec \ Big Brother bitwa\ - Bonifratrzy vs. Franciszkanie \piewajce organy\ \Ksidz szuka 偶ony Filmy\ O dw贸ch takich, co ukradliksi偶yc\ - biograficzny \ Id藕 na cao\ - czyli poradnik jak wypeni przekaz pocztowy dla Radia Ma ryja\ TALK SHOW I REALITY SHOW \ Jestem jaki jestem\ - reality show w domu o. Rydzyka \ \ Co za adwent!\ \ Z wizyta u Was\ - program koldowy. \ Parafia nale偶y od Ciebie\ \ Zakrystia - dokument jak powstaje msza\ \ Ktokolwiek widzia, ktokolwiek wie\ - program Wielkiej Inkwizycji \ Miliard na tacy\ \ Film dokumentalny - Lista Alimentacyjna Biskupa \ Klcznik Codzienny - transmisja z Paacu Kr贸lewskiego/Plebani SERIALE \ Pensjonat pod Toruniem\ \ Parafia na peryferiach\ - serial Nowa seria wzorowana na \ Pierwszej mioci\ - \ Pierwsza Komunia\ \ M jak modlitwa\ \ wiat wg redemptoryst贸w\ - \ Tata, a Ojciec Marcin powiedzia... \ serial edukacyjny dla rodzic贸w \ Stra偶nik dekalogu\ z Chuckiem Norrisem \ Sutannah\ - serial obyczajowy\ Kino Nocne - \Co drgno pod kome偶k\"" Chopaki do wzicia"" - kleryk na przepustce zwi"
"Pokazali mu gola babe na czworakach, to i sie zawstydzil i zareagowal glupim smiechem!"
A ja narnolmalniej w wiecie boj si co bdzie z naszym krajem. Teraz menele i nieroby bd dostawali po 500 z ( bo tych dzieciorob贸w jest najwicej) a sprztaczka przed emerytur zarabia 1300z.........ku....a niech jej dodadza.
"...baczcie, abycie nie udusili si w tym zaduchu odwetu, zajadoci i agresji wobec inaczej mylcych! PiS dosta - w odruchu na obrzydzenie pych PO - przeogromn wadz, ale szybko mo偶e polec pod jej ci偶arem, jeli nie poskromi swej arogancji i zachannoci na tantiemy tej wadzy..."
a on umie obsugiwa tablet?
"Jak si rodowitych ""Krymiak贸w"" na Sybir wywiozo a nawiozo ruskiej dziczy - to jest was teraz wicej na Krymie."
zobaczy w tablecie go bab jeszcze nie widzia
Jarkacz mia si 偶e tylu naiwnych Polak贸w wykiwa
No i co ?? - sprawdza si powiedzenie 偶e rudy jest wredny....sprawdza.
Niech POpisze do os贸b kt贸re POtraciy prac.
"Ka偶dy porzdny obywatel tego kraju powinien zbojkotowa TVP i nieopaca abonamentu oraz nieoglada plugastwa jakie proponuje nowy szef Jacu Cacu. 
Ciekawe kiedy nastpi fuzja TV Trwam i TVP?"
"No c贸偶 jeden z PIS-u otwarcie powiedzia ""ciemny lud wszystko kupi"" to jedyne w czym si z PIS zgadzam."
Zapomnieli doda 偶e badanie przeprowadzono na 1000 Polak贸w w wieku 70+ i antenie telewizji trwam i radia maryja!!
Zobaczy Komorowskiego z Grodzka pod prysznicem pewnie
"Czarny garnitur,wieczna 偶aoba i taka salwa miechu czy z jarkiem wszystko w porzdku?/????"
"Bardzo dobra  dziennikarka p. Karolina jeszcze  zawieci dla pani ,,soneczko,,  trzymam kciuki  oni sie  udusz t swoja pycha."
"Ja mam nadziej, 偶e pose Kaczyski gdzie poleci."
"niech rosja przestanie bredzi i sprzedawa dziczy bro, to wystarczy ! amen"
"Janie pan nigdy nie bra su偶cej za dnia, bo m贸gby B贸g zobaczy."
"Brawo Dominiko,nie bdziesz musiaa odby weryfikacji w Telewizji Trwam!"
"TVP powoli przestaje by tub propagandow POstesbecji, kt贸ra niedugo osignie granic progu wyborczego, co nieskromnie przypomn, przewidywaem wiele miesicy temu. :)"
"Odpieprzcie si od Kaczyskiego gdyby nie krzyk ludzi zwizanych z PIS-em to dzi mielibymy w kraju tumy tej dziczy z koranem na ustach, kt贸rzy traktuj kobiety gorzej ni偶 psy . Panie Kaczyski nie s.chodzcie z tej drogi.A PO do budy i na SYBIR."
"lewackie wpisy to dzisiejsze - ukrzy偶uj Go, ukrzy偶uj Go ....."
"Ja naprzyklad nie mog znie tych butnych usmieszkow, dudy i kaczyskiego, ciesz si szyderczymi usmieszkami. Wilcze oczy dudy przebijaj oczy Tuska."
"Bzdura, Korwin 15%, swetru pewnie ze 3% bo to dure i nastpca PO."
"poczytajcie sobie o dochodzeniach w sprawie r贸偶nych katastrof lotniczych na wiecie.........
ot chocia偶by tylko ostatnich dw贸ch .......
i jeli uwa偶acie, 偶e wszystko w sprawie Smoleska byo o'k to........
呕al mi was..........."
"Dlaczego 436 baran贸w w Sejmie wybranych przez 5,5 mln os贸w a Polsce ma prawo rozwali cay ustr贸j ????????"
jeszcze bdziesz si mia wilczym gosem !
Spadaj Bolek jeszcze ci emerytur zabierzemy kt贸ra ci wspaniaomylnie komorowski ostatniego dnia podni贸s
"""Samo expose zebrao niemal tyle samo dobrych i zych ocen."" Dobre oceny daj nieuki, kt贸rzy nie maj elementarnej wiedzy gospodarczo-ekonomicznej"
Hanna Lis to dla niej znakomite grono ! Bardzo dobrze ze ja wyrzucili !
Jak zwykle pisowskie brednie co ta banda jeszcze wymyli.
zaczn przychodzi nowi w sutannach-to bd prawdziwi polacy
"Hi hi, CBOS od pani premier dosta now ksi偶k telefoniczn respondent贸w."
Ten PiS to dopiero banda pana Rydzyka
Lenym dziadkom ju偶 dzikujemy za OFE...wstyd i haba!!!!
Bdzie.  a tobie co do tego jed藕 do niemiec na parad r贸wnoci- odpr偶ysz si . :-)
Ewa-wszendubylska Ewa?-sponsorowana przez Petru?
Kaczyski si mieje 偶e Szczypiska chce mie jeden pok贸j razem z nim w Jachrance ! A on ju偶 si um贸wi z Krysi Pawowicz.
Kazdy ma sw贸j sonda偶  zale偶y z ktroej opcji  . Za 4 lata konus bdzie mia 105%
HOLY PISLAM
lemingi PO-wskie zapomniay 偶e kiedy do wadzy dosza koalicja PO-PSL to wyrzucia ze wszystkich pastwowych stanowisk PiS-owc贸w i obsadzia swoimi. A teraz skowycz na wszystkich forach. A wic jak Kuba Bogu tak B贸g Kubie.
Sonda偶 robiono na reprezentatywnej pr贸bce Polak贸w przed orodkiem pomocy spoecznej i po mszy na 8 rano
Kto go nauczyl uzywanie tabletu?/
"hahahahah ,mowilam bedziemy tylko klaskac  ///zaraz  beda tylko pochlebne komentarze !"
"Rozmieszyo go,偶e jest Flapem,a nie Flipem w memie infantylnego brukselczyka."
Ciemny lud co da si nabra na obietnic malekiego guru i nudy ministranta w zacisznym mundurku篓
Imponujca znajomo burdeli. Podziwiam i zazdroszcz.
"A dlaczego nie ""Kiepscy""????Na wigili, dla leming贸w - jak znalaz!!!!!!"
"musia przewietrzy dzisa, bo zb贸w nie ma"
Czarnecki r! Zamilcz!
oglda pornusa
"PiS nie przej jeszcze wadzy a ju偶 mamy parali偶 - nie ma kto jecha na nieformalny szczyt unii. Oczywicie z winy PiSowskiego prezydenta. Podobny ""bd"" mia miejsce w momencie wylotu TU154 do smoleska gdy zgin Lech Kaczyski. To przecie偶 kancelaria prezydenta ustalia list pasa偶er贸w (wysocy wojskowi, prezydent, elity polityczne). To przecie偶 wanie prezydent Kaczyski wpywa na decyzj pilot贸w wczeniej. Najgorsze w PiS jest wanie ta pogarda dla prawa, hipokryzja i kamstwa w 偶ywe oczy. Nie dawniej jak par dni temu prominentny polityk PiS pr贸bowa zrzuci zamieszanie ze szczytem unii na Tuska - czyli kama w 偶ywe oczy. Sdz 偶e po PiSie mo偶emy spodziewa si jedynie zych rzeczy - destabilizacji pastwa, odsunicia si od UE (co jest na rk Putinowi) i rozo偶enia finans贸w pastwa na opatki."
"Chy偶y r贸j myli, 偶e na niemieckich plecach wr贸ci tu rzdzi? Czy tak bezinteresownie postanowi nam zaszkodzi?"
"Myl, 偶e teraz ciekawsza byaby debata o roli Jarosawa Kaczyskiego w stanie wojennym. Pytanie dlaczego nie zosta internowany samo si nasuwa. Czy to prawda, 偶e na pocztku lat dziewidziesitych sam sfabrykowa faszywki, kt贸re podo偶y do swojej teczki w miejsce oryginalnej lojalki i donos贸w."
"A skadzez to pimaki wiedza,jezeli posiedzenie jest zamkniete dla nich?"
Normalnie prawie umar ze miechu!!!
"No i co, rusofoby? Zadowolestwo was ogarnia? Saryusz, ty to zrobie do sp贸ki z Kowalem?"
"do  Kauflandu na kas i zapierdala do 67 roku, dziennikarka od siedmiu boleci"
"a ja nie, ja mam do niego wielki szacunek, za to 偶e tyle zodziei wykurzy ... do Niemiec, tak jak Lisa"
"PIS ' g贸r', a jaja bd jeszcze wiksze. lepota wyborc贸w."
"Oglda ,jak podskakuj kodowicze na jeziorze i nagle l贸d pka...:)))"
"Napewno czyta kaway na sw贸j temat albo na prezydenta lub premier . Bo tylko tyle pozostao dla opozycji kaway wymyla i opluwac , osmiorniczki si skoczyy ."
"smial sie z wlasnej glupoty,amen."
"Wa偶ne, 偶e nie byo tam sfilcowanych swetr贸w i temu POchodnych."
"W dwa miesice PiS,prezydent i premier zrobili dla Polak贸w wicej ni偶 PO w 8 lat .
PiS robi to czego chce nar贸d.A PO robio to czego chciaa Unia.Nauczyli dziadostwa i teraz trudno opdzi si od zdrajc贸w.A pozamyka zdrajc贸w narodu polskiego."
A ten rudy gentelman to jeszcze nie za kratami ??
Wypakaa si mocodawcom z Niemiec ! jak mi zal tej ubogiej biedaczki!
"nie dorozwinici tak maj, 偶e czasami rycz z byle czego"
"TO nie to rozbawio prezesa. Pokazano mu owiadczenie majtkowe wybitnego ekonomisty Petru. Ten wybitny fachowiec twierdzi,偶e mieszkanie 50-60 m2 w Warszawie kosztuje 100.000 z(sownie sto tysicy z)."
Kolor jakby buraczany
Nie 偶yj!
"Nic dobrego nie mo偶na si spodziewa PO partyjnym towarzyszu, tylko inwektyw."
"Saba warsztatowo, marna merytorycznie, typowe dziennikarstwo z tez, no i nie jest medialnie osobowoci. Zawsze si dziwiem, co ona tam robi, chocia偶 wiadomo, CO ONA TAM ROBI. Nawet Kura j ola i musiaa o sobie przypomnie..."
A absolwenci Akademii Toruskiego Hogwartu ju偶 kwicz koo koryta
A kto to jest ten kaczyski? To jaki sejmowy pajac jest?
"A co mysleliscie?  Ciemny lud to kupi, lud kt贸ry ma problem ze zrozumieniem dobranocki a co dopiero z obietnicami wyborczymi. A ja mowie Marionetko to si nie uda"
"Naprawianie pastwa po pisowsku, zobaczymy kiedy pierwsze ofiary zapac najwy偶sz cen tak jak p pani Barbara Blida ."
Miotaj si jak ryby w sieci !
Tvp to skrot od Telewizja Prezesa?
Kaczyski kreuje si na m偶a stanu. A to co najwy偶ej clown stanu
"Wirtualna Polska jest propagandow przybud贸wk wirtualnej Polski, z jakiej drwiy peowskie  obuzy u Sowy. Wystarczy policzy tytuy zamieszczanych felieton贸w. Same tytuy wystarcz."
"Prezes mieje si z ratingu, do kt贸rego przyczynili si panowie z PO, to po prostu s skar偶ypyty."
na urlop prosze jechac .Australia piekny kraj krokodyle karmic
A ja wiem z czego sie mia-SER ZOBACZY!!!!!!!!!!!!!!!!!
"Upowcy to zrobili to cacy, jak ruscy zakrc gaz to bdzie be. Polska katolicka mentalno"
tylko do tego si PIS nadaje bo jak narazie to nic mdrego nie wymylili
TUsk da jej  europejsk spejaln emerytur.
"Kto go wybra na to stanowisko ! gdzie bya demokracja :) jaja jak berety macie nar贸d za gupc贸w i pr贸bujecie wycign ludzi na ulice, no ja majc 1600 na rk na pewno  wyjd w obronie waszych koryt :)."
"kczyski zy, to niedobry , mieje si to te偶 niedobry, najlepiej to kaczyskim sobie brudn peowsk mainstreamow gb wyciera,"
"ale macie w porach psy platformy,psl owcy i cala reszta zlodzieji,ktorzy rozkradali ten kraj.wzieli sie za burego,powymieniali sklad trybunalu.niech was zamykaja jeden po drugim ,kradliscie tyle lat,wkoncu spotka was zasluzona kara.brawo pis"
Zrobi si poczenie ldowe z Rosj i prd bdzie. Ukraiscy gupcy
POkazali jemu filmik z przed lat jak oszuka z bratem rodzic贸w i ukradli ksi偶yc a teraz mo偶e uda si wykootkowa nar贸d.
"To jest ten kraj w ruinie,ruinie moralnej.Szambo po PO."
Kopacz pod Trybuna Stanu za przyjazd tego chamstwa muslimskiego
"W rankingu wybitnych osobowoci i zasu偶onych intelektualist贸w, prowadzi Marzenka Wr贸bel, a tu偶 za ni Piotru Gliski. Ale zaraz potem ex aequo, Beatka Kempa z Krysi Pawowicz. Do czo贸wki w peletonie doszlusowa jeszcze Jacu Kurski. To wielce zasu偶ona posta dziennikarska."
to jest jednak pr贸ba demonta偶u cywilizacji.I zastpienia jej filozofi mierci. Niech si wysadzaj troch bestii mniej.
"Poczekamy, zobaczymy jak bdzie si mia za p贸 roku, za rok."
Poleciaa na skargi..to ma od dziecistwa..skar偶ypyta..Sam si wykrusz..wszyscy ci kt贸rzy begotali na potrzeby PO..Id藕 bd lepsi..Lisa te偶 to dotyczy..
pettru do bani
"A mi  si z  was  mia, po  tych  waszych  偶aosnych  komentarzach. Wikszo  z  was  potrafi  tylko  krytykowa siedzc  i  pierdzc w  stoek nic nie robic."
"super inteligentne - jak si  nie ma argument贸w, a koniecznie si chce zaistnie,  to komentuje si wygld, A pizek podoba si sobie w lustereczku?"
kolejni funkcjonariusze aparatu propagandy PO-PSL odchodz z TV publicznej
"Ten si mieje, kto si ostatni mieje."
leja ze smiechu jak zobaczyli uciekajacego swetru do rumuni haha
Flipa i Flapa zobaczy...
"Brawo PiS tak DALEJ , nawet WP ju偶 kwiczy"
"tusku nie zabi politycznie schetyny, ewka go wskrzesia, to teraz klika korzysta perfidnie z 8-letnich ukad贸w... tusku zajmij si kolorowymi - zaraz ruszy 4 miliony kolejnych"
Bravo!! Nareszcie UE zrozumiaa 偶e w Polsce odrodzi si faszyzm. Jak przed wojn. Bravo!
"""bohaterski"" prezes NICZEGO SI NIE BOI, bo za jego tykiem przez cay czas chodzi CZTERECH ochroniarzy. miechu warte byoby moje i jego spotkanie w parku sam na sam - bez gapi贸w i jego goryli. To nie ja posikabym si w pampersa."
nareszcie wielka ekspertka do kitu
Do roboty leniwa Szydlo. Coz obietnicami.
sam z siebie bo zamiast suchac zajmuje sie gupotami jeden spi  druga je trzeci w nosie dlubie i maj kabaret
