"Donek nie pluj na wasny kraj, zakocz t hucp."
Raczej nie trzeba traci czasu na tego pseudu Polaka.
"Wiem co to znaczy straci prace po 30 latach, bo sama tego dowiadczam. Dlaczego? Bo tak chciaa posanka PIS i tyle. Teraz takie czasy, 偶e w imi wartoci chrzecijaskich gnoi si drugiego czowieka. To jest nowy wymiar umiowania bli藕niego. A potem po rozgrzeszenie do ojca i na nowo mo偶na gnoi innych."
"Spoko - raczej nie zje, ale kota to lepiej schowa, tym bardziej jak jeszcze ona nie wychodzia z domu."
"Czego pacze , jak odkadaa 30 lat to i ma z czego 偶y - a inni te偶 potrzebuj pracy. Po co te pacze - 偶aosne ..."
Jak tam LEMINGI...to byla wasza POwska demokracja co???zgodna z Trybunalem co???Ostro PIS brac sie za te podsluchy i do Komisji europejskiej przed Trybunal...
Dewoty do roboty si we藕cie. Jak kto chce i na porno to niech idzie. Nikt za mnie nie bdzie decydowa!!!
"pis wszystkich wywali dziennikarzy nastepny bedzie krasko, puzniej hanna lis, i tak pokolei duzo jest dziennikarzy do wywalenia zaczela sie dyktatura w tvp :(  zostana ci co beda chwalic pis szkoda slow ludzie co wy robicie kogo wy dopusciliscie do wladzy, chorego psychicznie na wladze kaczke wszyscy mu sa podwladni duda szydlo slepi ludzie jestescie. 500zl wam zamydlilo w oczach przekupili was a itak nie dostanie sie tego bo dochody beda przekraczac takie obietnice to kielbasa wyborcza i zlapaliscie sie:( izolacja bedzie w europie bo kaczka odizolowaniu nauczony zyc sam jest  i mysli ze polska powinna byc odilozowana :("
"Inteligentny czowiek, kt贸ry ma szacunek dla siebie powinien brzydzi si wsp贸pracy z mafi smolesk."
marchew obiecali i wygrali a PO z bulem NA TACZKACH odjechali
"Tusk oszust pisa, 偶e polsko to nienormalno. Powinien stan przed TS za donosy na Polsk"
Prosz kolejna afera i kombinacja PO. Czy teraz kto z tego wycignie wnioski? Jakim prawem oni zlecali Policji dziaania? To jest zagro偶enie demokracji. PO bdzie donosi na zagro偶enie dla UE a sami co robi? To ironia i przegrani ludzie!!!!!!! Zodzieje Tusk i Komorowski oraz Schetyna
"niech Austriacy ten SYF wystawiaj u siebie razem z ,,gwiazda concit''"
Nareszcie TV zostaje oczyszczona z elementu antypolskiego. W kocu mo偶na obejrze wiadomoci inne ni偶 w prywatnych stacjach .
"Ten po藕al si inteligent z 呕oliborza,  zdajac na prawo powinien zna histori. Ju偶 w 1880 r. Ilja Riepin namalowa obraz ilustrujcy pisanie tego listu. A on majc prawie 70 lat si o tym dowiedzial."
Cieszy si z gupoty i naiwnoci gosujcych na jego partyjk
"Tak trzyma PIS i panie prezesie , Polsk trzeba zmienia , a zarazem gna lewak贸w tam gdzie jest ich miejsce.Pisudzki wiedzia by co zrobi ze zdrajcami polski."
Ale to byo tydzie temu i Kaczyski dopiero zaapa.
"Im bardziej niemcy dr jape i si pluj,tym bardziej jestem przekonany 偶e PIS postpuje susznie."
"O m贸j Bo偶e, teraz ju偶 wiem, dlaczego jest starym kawalerem."
najwy偶sza pora i teraz na front wschodni do banderstatu tam u paraszenki sa etaty w banderoskim raju
"senior to ty jeste ale gupoty.Przecie偶 tam 偶yj w wikszoci normalni ludzie,kt贸rzy si uchowali przed siepaczami z upainy."
jarek jarek kot twoj wlazl na drzewo!
Ten czowiek po 8 latach zodziejskich rzd贸w i niespotykanych afer w Polsce umiera ze strachu razem z Biekowsk przed odpowiedzialnoci.Na razie tyek im uratowaa Angela dlatego tak wiernie jej su偶 i Niemcom wbrew interesom wasnej Ojczyzny i Polak贸w.
"nie ka偶dy muzumanin to terrorysta, ale ka偶dy terrorysta to muzulmanin

czyli po prostu wystarczy si pozby si tej zarazy z Europy i bedzie swiety spokoj"
i jednak ma poczucie humoru...w przeciwiestwie do was nowoczeni POpapracy
No gdzie jestecie pisowscy katolicy?
"POSZCZYTUJ sobie z Merkel
Przyjemnie.... Nie?! Jed藕 do Kolonii"
"Nie bajdurz.  Wybrao dokadnie 5,7 mln. ludzi, z kt贸rych du偶a cz  ma dzi gdzie twoj ukochan parti i jej wodza. PiS  bezczelnie okamao spoeczestwo i kiedy za to poniesie konsekwencje, dlatego boi si Polak贸w, stara si go pozbawi wszelkiej mo偶liwoci kontroli. Tw贸j post to  pena hipokryzji klepanina, powtarzana w k贸ko przez pisowskie media, ale wiesz dobrze, ze  narasta protest i on nie bdzie si zmniejsza, bez wzgldu na wyrok Brukseli. Prdzej czy p贸藕niej  ten walce, kt贸ry rujnuje nasz kraj, zostanie zatrzymany. Koniec kropka."
Brawo rzd i prezydent robi dobr robot.  Ustali jak rozgonic t targowice.
"oooo faktycznie salwa pffffffffffffffff, nic nadzwyczajnego,  dzienikarzyna za 5 z"
to naprawda jest zalosne ze pis ma wladze
we偶 bolszewia kredyt i za贸偶 dziaalno.
To by POdgld z Brukseli a zobaczy tuska kt贸ry si POci i ociera chustk jak Chlebowski PO aferze hazardowej
teraz to piss zawsze bedzie mial 100procent w sondarzach bo inaczej ten co podaje w telewizji odrazu by wylecial. juz w mediach TVP pracuje tylko PIS reszta wyleciala  bedziecie sami si ogladac tvp wezcie sobie jaszcze rydzyka do info tylko jego brakuje dziekuje panu PANIE KURSKI 4LATA przetrzymamy ale ju偶 wiecej nie damy sie wam nabierac
"No przeciez Michnik przyjmie Pani bez pracy nie zostanie Pani a i o innych zwolnionych prosz si nie martwic oni juz wiedza jak si zakrci by komu w dupsko wej, bez pracy nie zostan..no przeciez dla nich bycie celebryt jest wa偶niejsze ni偶 dziennikarstwo..spokojnie poradz sobie."
zobaczy siebie w lusterku
"Wyprane,zwietrzae treci artykulik mieci."
Chyba w rozgoni radia i na prezia podw贸rku
Przecie偶 wszystkie obietnice zar贸wno Prezydenta Dudy jak i PIS s realizowane! Jedna za drug - stopniowo. Po co wic to podjudzanie? Czy偶by WP chcia by zdelegalizowany za kamstwa i dziaanie wrogie Polsce?
Kto m贸g to pisa tylko katolicy pisowcy.Tylko oni umiej straszy.
Poznasz gupiego po miechu jego.
wracaj Tusku do Polski chtnie podyskutujemy o twojej ucieczce do Brukseli
Luzik nie ma strachu - plastikowy Duda uaskawi.
Jak nar贸d si wcieknie to tak pogoni kota tym wybracom a偶 si wi贸ry posypi.Maj w gowach pozostaoci nieczystoci z tojtoj.Zenada.
"Te sonda偶e to same gupoty. Jak dorw ankieterzy ludzi pod kocioem ,to przewaga pis ronie, jak przeprowadzaj np. pod uczelni czy na ulicy ,to spada."
"Jarku! W zdrowym ciele zdrowy duch!
Jarku! A teraz jeszcze pierdnij na ten caly KOD  i jego POplecznik贸w!"
Mo偶e zobaczy nag Kryk.
"NIe wiem czymu ma sluzyc to publiczne darcie szat. Mam wspoczuc?poplakac na losem? Jak u nas zamykali zaklad produkcji cukru z powodu unijnych przepis贸w, na bruk polecialo 150 osob. Ktos sie nami zaj? wzruszyl losem naszych rodzin?nic z tych rzeczy. Czesc osob wyjechala z kraju, czesc znalazla marnie ptn robote, kilka osob targnelo sie na zycie. No ale ja tu mam plakac nad pania dziennikarka.. kij wam w oko"
"Ciemnosc pan widzi?  To i tak dugo pan wytrzyma z taka ocena bo byli szybsi ktorzy zaraz po wyborach zobaczyli ciemnosc i do tej tej POry nie moga sie POgodzic z lepszym ,,swiatem,,. Przegrana boli, bardzo boli. Widac to po twarzach chocby po TRZASKOWSKIM ktory z baranka sta sie wilkiem. W tej ciemnosci zgubi golarke."
7 latka na placu zabaw tez byla nie stosownie ubrana !!!! dlatego ja zgwalcono co wy wypisujecie wpiszczacie dzkusow terrorystow do domu i oczekujecie ze powiedza prosze dziekekuje nalezy ich deportowac i zamknac granice dla nich
"Ale was boli dobry Prezesa humor.... zaboli was jeszcze bardziej jak odtajni akta IPNu, zlustruj uczelnie wy偶sze i sdownictwo .... kwik bdzie straszny, najgoniejszy Lisohieny :)"
"ja wiem, to jarek wysya. Ale to jego kot pisa, a dudek podpisa, bo on wszystko podpisuje co mu prezes podsunie. Tylko nie wiem, kto jarkowi pom贸g wysa, jak on przecie mejli sa nie umi. A propo, kiedy trzyma piniondze na moncie swojej mamy, a gdzie trzymie dzi, jak mama nie 偶yje, a on konta ni mo, bo bank贸w nie lubi? Pewnie pod koci kuwetk..."
mieje si z swoich wyborc贸w---i z tej drogi nie zejdzie.
czyli za molestowanie w Niemczech grozi zakaz wstpu na basen????????
"niech bdzie TV-TRWAM po angielsku! Mamy, My, Nar贸d Wybrany prac zlecon od JP-2: ewangelizujmy bezbo偶ny wiat. I Chrystusa wreszcie korzystajc z poparcia PiS ukoronujmy na kr贸la IV RP!"
"Teraz zaczn si nagonki w imi obrony medi贸w narodowych, susznej i jedynej drogi z kaczk na czele."
"Muzumanie s pod ochron, nawet ponad prawem. Biali maj do odegrania rol owiec.Do strzy偶enia i jako miso. Brawo UE"
na POhybel
To by pewnie siusiak Macierewicza :D
A co ma innego do zaproponowania wnuczek dziadka z Wermachtu?
PISIE DZIKUJEMY !!   WYMIATAJCIE T SITWE  TO TOWARZYSTWO WZAJEMNEJ ADORACJI
"Brawo Kurski ! Wszystkie wrzody POwycina ! ! !  PiS podj miertelny b贸j z ""ukadem trzymajcym wadz""  Je偶eli chcemy pastwa praworzdnego, przyjaznego obywatelowi to musimy pokona wszechobecn ""sitw"" /czytaj mafi/"
"To jest typowa chrzecijaska nienawi.Co niekt贸rzy katolicy zupenie odeszli od nauk chrzecijastwa.Nienawi,wcieko,narzucanie innym swojej wizji 偶ycia,i bardzo du偶a nietolerancja.Tacy ludzie chc decydowa co mamy oglda,czyta,i jak 偶y.Czy ktokolwiek zmusza przedstawicieli krucjaty r贸偶acowej 偶eby poszli oglda t sztuk.Ka偶dy ma sw贸j rozum,i swoj wol.Tylko przedstawiciele krucjaty uwa偶aj 偶e oni wiedz co jest najlepsze dla pozostaych mieszkac贸w naszego kraju.Id藕cie si modli,odmawia r贸偶aniec,a nie wtykajcie nosa w cudze 偶ycie,nie 偶yczymy sobie waszej ingerencji w nasz byt."
"A ja mam propozycj!
Niech abonament pac ci wszyscy wielbiciele PiS-u.Przecie偶 to Wasze media. Nie bd paci za propagand pisowsk."
"Elizo a lemingi to Polacy, czy nie? Czy Polakami s tylko mohery?"
Zegnam ozieble stygnace zwoki!! Do opaty nieg odgarniac!!
Tam s amane prawa arab贸w ! Wysa KOD !!!
"Prezes zobaczy w internecie skd si bior dzieci ,, bo nie wiedzia a偶 do pitku ... teraz dopiero zrozumia po co jest potrzebny program 500+"
"Nie tylko Islam.Ka偶da religia wywouje agresj ,ma monopol na tylko swoja prawd.Wszystkie ,prawie wszystkie konflikty zbrojne na wiecie powodowane s przez religi .Wierni wiedz co chce ich B贸g,tak jakby z nim rozmawiali.Obraza uczu  religijnych ,kolejny nonsens.Gdyby B贸g czu si obra偶ony sam by ukara blu偶nierc贸w. Powiedzia,cyt. jam jest B贸g mciwy,i wiele razy to udowodni.Religia nie czy ludzi,przykad Rydzyka czy Kaczyskiego.A stosy na heretyk贸w?"
"Nie martwcie si, kole偶anki Gosiewskiej Bojke i Stepan awansuja, a nowe kadry z ""uczelni toruskiej"" ju偶 tr nogami."
klamca sami podali sie do dymisji.
"Hm, jest takie mdre przysowie: ""pozna *** ze miechu pustego"". Rym jest atwy.;)"
"Zaraz   pozbawimy  ciebie obywatelstwa  zajady , kiepski obserwatorze. Zacianek"
"jak to co Petru wszedzie , albo drugi zdrajca Schetyna z budk,"
"Moze pani jeszcze w Midrasz, jeli pani tak nienawidzi goj贸w."
Zamiast cicho siedzie to cigle miesza
jantar贸wka - nie por贸wnuj jakiej tam prowincjonalnej dyrektorki do powa偶nych sdzi贸w TK.
"Nie wiem, kiedy lemingi zrozumiej, 偶e PiS i jego wyborcy te偶 potrafi pokaza rodkowy palec?"
Super widocznie si nachapaa i ma dosy .ciekawe kto j sponsorowa.
Tylko nie zapomnij nao偶y moherowego bereta bo zmarzniesz.
mia si z durnej opozycji
"Darmozjad,tak  nieudacznicy i lenie pracuj."
"Tym sie zajmuje prezio na posiedzeniach sejmowych , widac ze ma w tyku wszystko i wszystkich , wstyd i hanba."
Nie bdzie mu do miechu jak go beda rozliczac za 4 lata
Sama obluda
Nie mog poj skd ten upierdliwy petru ma tyle punkt贸w procentowych.
"Panie Jacku, prosz szerzej zagarnia t miet! Jest jeszcze wielu resortowc贸w do wywalenia na szczaw i mirabelki!"
Zastanawia mie kto teraz bdzie prowadzi wiadomo ksidz cz towarzysze partyjni prezesa tvp??
prezio -a widziales sie na FB???? dopiero bedziesz sie smial.
"mieje si jak gupi do sera, to ""stwierdzenie z jego pokolenia"""
"Narcyz Kurski  decyduje w TV ... to ten niby twardy i wyrazisty... parafrazujac Hofmana ,ktory chwali sie kole偶ankom -""dugosci"" ,pan Kurski chwali sie -""twardosci"""
"Jestemy w trakcie budowania IV RP. Dzikujemy panu Gliskiemu za genialne pomysy na dzi i oczekujemy r贸wnie genialnych na jutro. Najlepiej nie pokazujcie tego ""geniusza"" bo ludzie trac dobre samopoczucie."
"szkoda porzdnych bdb. merytorycznie dziennikarzy. Teraz przyjdzie pob贸r ze szkoy Rydzyka. Brrr... Ju偶 nam PiS zakada klapki na oczy na razie w tv. Pzryjdzie czas na gazety ""lub czasopisma"". Polska osuwa si w kierunku dyktatury. May, siwy, okrglutki steruje swoimi supami za pomoc pilocika. Najwa偶niejsi urzdnicy w pastwie okazuj si by partyjniakami oddelegowanymi do penienia tych funkcji przez parti. Skd my to znamy? Dawny Komitet Centralny by na skrzy偶owaniu: Marszakowskiej/Jerozolimskie. A teraz w ParteiFirer w willi 偶oliborskiej - lub na Nowogrodzkiej. A superCentrala bya w Moskwie. Wraca NOWE. Pierwszy sekretarz partii jedynie susznej steruje. Po staremu: Partia steruje, a rzd rzdzi."
Lepiej od jarusia nie wyczyci swojej teczki nikt.
"A z kogo si mo偶na tylko tak mia? No jasne, 偶e z atencjusza-franka petrusa."
"Ot tak wlasnie  PiS  uwaznie  uczestniczy w obradach SEJMU- chyba zobaczyl w tablecje  przystojnego ladnego chlopaka ze tak go  to rozbawilo,zapewne bedzie teraz przez sluzby specjalne go chcial miec"
m贸wicie gby i nie do uczeni ok a ilu mamy uczonych i z tytuami a pluj na POLSK konstytucj i nar贸d a pan P. G....to mie z klapkami jak ko
Dlaczego tego czowieka pokazuj na wizji to obd.
Red tube oglda jak araby ubogacaj 4 Rzesze
Ronie ci nos Bolek jak u Pinokia
Wiesawie Dbski na kogo gosowae? Czy jeste w KODzie? Je藕dzisz do Niemc贸w wypakiwa si na amanie demokracji?
"skoro dla niej znamienitym gronem jest Lewicka i Lis, to ju偶 si ciesz, 偶e na zbit mord posza !!!!"
"m贸j szecioletni wnuk te偶 si mieje przegldajc swojego tableta, tak jak nasz ""may rycerz"" w awie poselskiej, kt贸ry w dzie bawi si tabletem a w nocy pracuje nad uchwaami"
"a czy agenciura cia (zdradek) bedzie scigany miedzynarodowym listem gonczym? 
co z innymi afeszystami typu rudy oszust, szczynukowicz, miler i kwasniewski?
czy PIS powola komisje w sprawie lapowki 15 milionow USD za prawo do torturowania na terenie Polski? czy torturowanie ludzi jest MNIEJSZYM ""wykroczeniem"" przeciw PRAWU i DEMOKRACJI oraz ""europejskim wartosciom"" dla uni niz wymiana kilku telewizyjnych blaznow od PROPAGANDY pelo?"
"Zastanawiajcy jest fakt,偶e ludzie pis-u z umiechem na twarzy w bezczelny spos贸b potrafi ka偶de kamstwo przedstawi jako rzekom prawd i wmawia, 偶e robi to dla dobra og贸u. A tak naprawd jest to cynizm majcy na celu tylko i wycznie dobro wasne lub partyjne."
"Ludzie dajcie spok贸j, co przecitnego Polaka obchodzi 偶ycie prywatne i praca jej paniusi????? Nic. Polska to 38 mln kraj naprawd to wycie progandzistki PO i PSLu w mediach pastwowych bo nie publicznych bo nigdy takie nie byy jest cokolwiek mieszne"
"A JA PROPONUJE NA SPIKERKI DO TVP1 i TVP2, GWIAZDY PIS KTRE WNIOS POWIEW WIE呕OCI I KOBIECY WDZIK - KEMPE I PAWOWICZ."
a co to smiac sie Kaczynskiemu nie wolno? ta wp.jest gupia i beznadziejna
"Oto caa prawda o lewakach o tym jak bardzo PO byl i jest zakamana. Wida do czego s zdolni po przejeciu wadzy przez PiS, partii wybranej w demokratycznych wyborach przez nar贸d Polski. Wida to przez dziaania tworu obocznego PO pod nazw Nowoczesna. Wida jak ci ludzie dziaaj na formu miedzynarodowym na szkode Polski.  "" Zy to ptak co wasne gniazdo kala"""
a kiedy wywal z TVP pro banderowskie dziennikarki tj. Bojke i Stepan?No chyba 偶e rzd PiSu jest tak偶e pro banderowski...
"Jako mi jej nie 偶al. Jeli ta Pani twierdzi, 偶e nie ma nic sobie do zarzucenia...to rzeczywicie, dobrze 偶e zo偶ya to wym贸wienie. Baba z wozu, koniom l偶ej."
Bo teraz gosciom z PIS trzeba bdzie wysyac pytania tydzie wczesniej! I 偶adnej improwizacji!
Zatrudni dziennikarzy z tvp Trwam i RM. Wiadomoci bd obiektywne.Gratuluj nam wszystkim rozumu.Mam nadziej 偶e p Lewicka i inni dziennikarze znajd prac w normalnych mediach.
"Ten si mieje, kto si mieje ostatni.Ju偶 niedugo prezes przestanie chichota."
nosi pampersa
"Dziennik powinien prowadzi ksidz i dwie siostry zakonne,i to jest prawdziwa reprezentacja pisu i kocoioa rzymskiego. Na was tez przyjdzie koniec i wac rozliczymy."
"Idzie dobre, koniec z przekrtami. Lud te偶 ma du偶o do powiedzenia a nie tylko pracowa na darmozjad贸w i obcych. Oby tylko i ci, kt贸rzy teraz rzdz zrozumieli o oszczdzaniu, kalkulacji koszt贸w, ograniczeniu koszt贸w utrzymywania partii, utrzymania parlamentu itp."
Pewnie do sera.
Zrobibym jej minetke
"Swiat krytykuje bo zmainy wprowadzane przez nowy rzad to kierunek dyktatury, podporzadkowujaca trybunal, sadownictwo i glowne media. Ten rozboj i prywata polityczna ma na celu zaklamanie rzeczywistego obrazu Polski jak to ma na Bialorusi i w Koreii Polnocnej. Ostatni etap to blokada internetu i zamkniecie granic. Platni trole pisu dominuja na forach choc tak naprawde na to ugrupowanie glosowalo raptem okolo 5 milionow Polakow."
"Za P.Gliskiego media bd tylko UPisowione , i takie maj by.To jest najbardziej waciwe i prawidowe.Biedna bdzie ta Polska majc takie ""elity""."
"Gupki wci偶 czekaj na 500 z na dziecko (jedyna obietnica, kt贸rej PiS dotrzyma, cho nie wiadomo, kiedy), przywr贸cenie poprzedniego wieku emerytalnego, podniesienie kwoty wolnej od podatku do 8 tys., darmowe leki dla senior贸w, obni偶k VAT itd. Najdalej za rok zrozumiej, 偶e dali si oszuka jak dzieci."
Krzy偶yk na droge !!!
"i bardzo dobrze, powinna si nazywa Lewacka"
"...baczcie, abycie nie udusili si w tym zaduchu odwetu, zajadoci i agresji wobec inaczej mylcych! PiS dosta - w odruchu na obrzydzenie pych PO - przeogromn wadz, ale szybko mo偶e polec pod jej ci偶arem, jeli nie poskromi swej arogancji i zachannoci na tantiemy tej wadzy..."
to a偶 tyle moher贸w jest w POLSCE ?
zobaczy Pawowicz w bikini
mieje si jak g.. do sera.
Ale kas od tego szkopa  chtnie  bie偶esz.
Na redtube oglda striptiz Pawowicz.
"Tarowica , sprzeda Polsk za srebniki, Judasz"
"A niech sie ciupciaj si intelektualnie w tym teatrze, ale od Zdrowa Maryjo wara, bo miliony ludzi uwielbia i wierzy w Maryj, uosobienie dobroci i mioci."
Sami inteligenci na tym forum.
"Wicej szacunku dla Pana Wasy, gdzie wy bylicie jak on walczy i by internowany. Brak kultury. W kocu to prezydent Polski. A bezczelno tych panienek jest pora偶ajca, zapewne  Pan Kaczyski chyba nie by internowany? Nie te panienki z mikrofonem jego zapytaj."
te 500 z to sobie wiesz gdzie mo偶esz wo偶y .....
Ogtlda wasne wystpienie!!!! Te偶 sikam ze miechu gdy go widz!!..:))) Stary piernik!
Salcie ale my ci tam nie chcemy
Z CIEMNEGO LUDU!!!!!!
Tusk to mason
baba   a  ty  jeste  pokrcona . Niech  rzdzi  PIS  i  bardzo  dobrze.
Straszny miech-wyraz twarzy nie wiadczy o wysokim poziomie inteligencji tego czowieczka!!!!..
bo se jaja przysiad
"Wszyscy normalni dziennikarze odeszli. Zastpili ich sekciarze od Rydzyka. Nie ogldam od dzisiaj tego syfu. Do tej pory miaem wyb贸r, Tv publiczna lub Trwam, ale to si skoczyo, Trwam jest wszdzie..."
bardzo dobrze super na bezrobocie za 560zl i tyle juz dosc sie nabrala kasy za nic
"Czekam tylko kiedy Kurski ogosi w TV 偶e Polska ju偶 nie jest Polsk .Bo na pewno po nocnym sabacie PIS-u , ciemnej  nocy tak si stanie"
"JELI JA W SWOJEJ PRACY ZAMIAST WYKONYWA OBOWIZKI KORZYSTABYM Z TAKICH URZDZE JAK TABLET I ZAMIAST PRACOWA ... BAWIBYM SI, TO JUTRO STABYM W KOLEJCE W URZDZIE PRACY. RESZTA NIE MA CO KOMENTOWA ... CESARZ SI MIEJE, A PADAANI JESZCZE  BARDZIEJ :-)"
"Ja  mam mieszkanie 50 metr贸w kwadratowych i jako dobry chrzecijanin mog do siebie przyj okoo 30 biednych uchodzci贸w ze sryjjli israku Zasranu i chgw z jakiego kraju. Od glowy 2000 dolar贸w miesicznie, bo ich na to sta. Wolny pokoj ma 25 m, a podloga jest ciepla. Lodowke mog spokojnie na Antarktydzie mie. W tym koszcie oczywicie nie ma mowy o prundzie i guzie. Dla samooborny mam czeska wiatrowke, kt贸rej uzyje w razie ataku. Zreszta Polscy obywatele zgodnie z prawem mog mie proce, bo bejsbol zbyt popularny nie jest."
Ja bym raczej zwymiotowa:)
brawo kurski niezalowac dzieciom resortowym wolnosci niech lykaja i zachlystoja sie i napiewaja wolnoscia  jeszcze dobrze by sie stalo aby bylo prawo dla dzieci resortowych i ich dzieci zero przez najblizsze 10 lat zajmowania jakich kolwiek stanowisk w kazdym resorcie publicznych stanowisk tuska bienkowska rozliczyc itd itd
"ludzie czasami mam wra偶enie jak czytam wasze wypowiedzi 偶e jestem w III Rzeszy gdzie Hitler organizowa boj贸wki :(
nacjonalizm w Polsce jest ju偶 tak silny jak w Rosji smutne 偶e to w kraju katolickim takie szerzenie nienawici modle si za Polsk 偶eby ludzie si tak nienawidzili Jezus tak by nie zrobi"
"Inteligentni obywatele zapewne zauwa偶yli, i偶 nie jest prawd, 偶e koczy si demokracja. Ona dopiero si zaczyna. Prawd natomiast jest, i偶 wreszcie zakoczya si demonokracja, serwowana nam przez byych tubylczych m偶yk贸w stanu, libera贸w - afera贸w, zmutowanych marksist贸w - ateist贸w, kt贸rzy w omioletnim okresie bd贸w i wypacze, uprawiali polityk ogupiania                i upienia, rolowania i trzebienie, podjudzania i dzielenia, obmiewania i wyszydzania. W obszarach zewntrznych, zabezpieczali 偶ywotne interesu naszych strategicznych partner贸w ze   i zachodu oraz szemranych korporacji tubylczych i zagranicznych, na koszt biedniejcego ludu. Deformowali tak偶e nasz kultur i to偶samo narodow, narzucajc nam obrzydliwe wynalazki rewolty seksualnej homo - gender oraz pora偶ali nas obrazoburczymi i blu藕nierczymi sztuczydami np. Golgota Piknik, pora偶ali nas antypedagogik medialn, sdownicz i szkolno 芒 uniwersyteck."
"Wielki szacunek dla Pani.Godno osobista to podstawa.Ci co dzisiaj rzdz tej godnoci nie maj.Jeszcze niedawno obrzucali si ajnem, dzi zn贸w klepi si po plecach.Ludzie bez honoru i ambicji ."
Panie czemu przestales walczyc o tych na ktorych plecach zrobiles kariere
"dowiedzia si, 偶e ""szczypawa"" jest z nim w ci偶y, a on jest bezpodny"
"damy, nie jak wy lemingi uciekajce od rozsdnego mylenia"
"Trudno, USA niech ze偶re t 偶ab, a araby niech wycinaj si na swoim terenie. Pora ich tam wysa z powrotem."
"A przeczyta 偶e jest hetero, a dalej przeczyta 偶e grodzka to kobieta."
ale to jednak chopek roztropek.....ten Kaczyski. Jak on zrobi tak karier z tak postur i wygldem to ja nie wiem????
godnemu chleb na myli ... Michnik TO TY ???
Ciekawe co bdzie jak Rosja wsztrzyma dostaw wgla i gazu na upadlin przy bardzo ujemnych temperaturach ...chyba wtedy normalni ludzie podzkuja banderowcom za ich terorystyczne dziaania.
"Eryk, odrobine szacunku dla tego pokolenia. Gdyby nie Wasa i inni walczcy a i wikszoci narodu polskiego do dzisiaj byaby komuna, mur berliski , ZSRR. Jeste mody i po wpisie wida zbyt gupi 偶eby si rozwija skoro nie potrafisz doceni tego co jest teraz w Polsce i Europie. Musztarda i ocet w sklepach, wyjazdy tylko do demolud贸w i to z paszportem, zero wolnoci sowa, podsuchy, dziwne aresztowania...du偶o wymienia. Jeste niedouczonym i niedoinformowanym smarkiem, karierowiczu od siedmiu boleci... Wkurzye mnie na maxa"
Dobrze Prosz do tvn nie zapraszac ludzi typu kierwinskiego - glowa kwadrat w przyszlosci prostokt -tak 藕le jest chyba w Polsce.
"To najbardziej rzetelni dziennikarze w Polsce. Nie ulega to wtpliwoci.Mog je mie tylkoludzi ciemni, nie mylcy samodzielnie, ktorym do szkoy byo bardzo pod g贸rk."
"PISOWSCY WKLEJACZE MAJ PENE RCE ROBOTY. CO DROGI MINISTER W RZDZIE B. SZYDO PLECIE TAKIE GUPOTY, 呕E NIE NAD呕AJ Z ICH OBRON. PRACUJ PENE 24 GODZINY NA DOB I SI GUBI W TYCH BZDURACH WYPOWIADANYCH NP. PRZE WASZCZYKOWSKIEGO. TEN PISOWSKI BETO PRZEZ LATA SZKALOWA R呕NYCH POLITYKW UDAJC WIELKIEGO SPECJALIST OD SPRAW NIEWA呕NYCH I BZDURNYCH. A SUSKI TO ZWYCZAJNY PIESEK J.K. SZCZEKA NA WSZYSTKICH I SIKA GDZIE POPADNIE. TACY S POLITYCY PISU."
"To sie zgadza, Kaczynski ze swoja mentalnoscia pasuje do XVII wieku. Do dzisiejszych czasow kompetnie nie pasuje."
PISIAKI jezeli tvn wam si nie podoba to dlaczego politycy pi w nim tak czsto wystpuj to mnie zastanawia -parcie na szko.Obuda
"NO C呕 - JAK TO W WIECIE MAFIJNYM,TRZEBA GONO KRZYCZE ""APA ZODZIEJA"" I GONO PROTESTOWA KIEDY ZODZIEJ JEST CIGANY. (ale ten prawdziwy)"
"B贸g , honor , ojczyzna , kibole, szaliki, pochodnie,  rozr贸by, takie mam skojarzenia"
"Na pewno oglda nagie foty Pawlowicz, Kempy i Szydlo, mialllll"
Oszczerek
Odnonie niekt贸rych komentarzy: ciekawe dlaczego banderowcy lubi tak znienawidzony ruski gaz.
"Dbski to nie 偶aden dziennikarz, to prosty propagandzista PO."
... wasza ziemia. Wynosi si stamtd.
"Niech 偶yje nam generalissimus Kaczyski, ojciec narodu w Polsce. ! ! !"
To chyba nie widziae tego programu...
Tusk to Kaszub-czarne podniebienie. Czego mo偶na oczekiwa od takiego typa.
Zobaczy NAG MERKEL ?
"DO ROZPUKU?  OJ, 呕EBY TYLKO SI NIE ROZPUK."
Pozwolili mu wyj z konta biedak chce udawa Polaka? Czy przypodoba  si to musi by smutne
Do widzenia i... nie wracaj !
Pewnie zowieszczo si mia tak jak wczeniej wedug leming贸w zowieszczo milcza? A mo偶e tak co dla r贸wnowagi Wp napisze o naszej Barbie jak bronia polskich interes贸w w Brukseli?
"Bolszewicy z PiS rzdz ledwie trzy miesice, a ju偶 dostali 偶贸t kartk od spoecznoci midzynarodowej i popchnli nasz kraj w kierunku skansenu Europy. Jak tak dalej p贸jdzie, to z nas Jarosaw Polsk Zbaw i jego ferajna uczyni G贸rn Wolt, republik ciemniak贸w."
"Nawet jak si mieje to brzydko wyglda ;-)
Tak na marginesie to prezes ma zawsze min jakby cigle rozpamitywa smoleski i umiech na jego twarzy wyglda zupenie nienaturalnie"
"jak si nie ma nic do powiedzenia, to si pluje jadem. Ot, taka ""demokratyczna"" lewicowa przywara"
Szkolenia medialne w Toruniu
"Szacunek dla niej !!!!
 Rydzyk i dyktatura przejmie wszystko w TV !!!"
ja myl 偶e w kocu skuma 偶arty Strasburgera z Familiady
"Dobrze napisaa co do towarzycha manipulator贸w faktami.Mistrzami manipulacji prawd jest TVN,wic tam jest jej miejsce."
Z Ciebie偶 mo偶e - w kocu na niego gosowae
